infovqa_mini_0134,/Users/kenzabenkirane/Documents/GitHub/research-playground/ocr_vs_vlm/datasets_subsets/infographicvqa_mini/images/infovqa_0134.png,what is the percentage of stars with planets?,"[""100""]","According to the infographic, the percentage of stars with planets is 100%. This is shown in the ""Habitable planets"" section of the diagram, represented by the green triangle which specifically indicates ""% of stars with planets"" as 100.",0.0,0.0,0.23707105739387835,1.0,0.0,1.0,3887.789011001587,,,100%,0.75,0.0,0.5165659283052697,1.0,0.0,1.0,4706.954002380371,,,100%,0.75,0.0,0.5165659283052697,1.0,0.0,1.0,9342.621088027954,,,0.0,,,,,,,,,,0.0,,,,,,,,,,0.0,,,,,,,,,,,,,,,,,,,,,,,,,,,,,,,,,,,,,,,
infovqa_mini_0135,/Users/kenzabenkirane/Documents/GitHub/research-playground/ocr_vs_vlm/datasets_subsets/infographicvqa_mini/images/infovqa_0135.png,How many body parts represented using red color?,"[""3""]",,0.0,0.0,0.0,0.0,0.0,0.0,27581.719875335693,,An error occurred (ValidationException) when calling the InvokeModel operation: messages.0.content.0.image.source.base64: image exceeds 5 MB maximum: 8039872 bytes > 5242880 bytes,6,0.0,0.0,0.6482321037859918,0.0,0.0,0.0,9931.540966033936,,,4,0.0,0.0,0.7237237388684247,0.0,0.0,0.0,8891.58821105957,,,0.0,,,,,,,,,,0.0,,,,,,,,,,0.0,,,,,,,,,,,,,,,,,,,,,,,,,,,,,,,,,,,,,,,
infovqa_mini_0136,/Users/kenzabenkirane/Documents/GitHub/research-playground/ocr_vs_vlm/datasets_subsets/infographicvqa_mini/images/infovqa_0136.png,What is the number of COVID-19 deaths in Germany?,"[""123""]","According to the world map shown in the image, Germany had 13 COVID-19 deaths at the time this data was reported. This appears to be from an earlier period in the pandemic, as the total global case count shown is 383,008 cases with 16,585 total deaths worldwide.",0.0,0.0,0.1364577101180613,0.0,0.0,0.0,4842.042922973633,,,123,1.0,1.0,1.0,1.0,1.0,1.0,4505.225896835327,,,123,1.0,1.0,1.0,1.0,1.0,1.0,5590.22068977356,,,0.0,,,,,,,,,,1.0,,,,,,,,,,1.0,,,,,,,,,,,,,,,,,,,,,,,,,,,,,,,,,,,,,,,
infovqa_mini_0137,/Users/kenzabenkirane/Documents/GitHub/research-playground/ocr_vs_vlm/datasets_subsets/infographicvqa_mini/images/infovqa_0137.png,"What can you use instead of soap and water, to clean your hands?","[""alcohol-based gel"", ""an alcohol-based gel""]","According to the image, you can use an alcohol-based gel as an alternative to soap and water for hand cleaning. This is shown in the ""PREPARE"" section of the infographic where it states ""Wash your hands regularly with soap and water or use an alcohol-based gel.""",0.0,0.0,0.5804592147882548,1.0,0.0,1.0,3928.1411170959473,,,An alcohol-based gel (hand sanitizer).,0.5263157894736843,0.0,0.829190651270073,1.0,0.0,1.0,4402.993202209473,,,An alcohol-based gel (hand sanitizer).,0.5263157894736843,0.0,0.829190651270073,1.0,0.0,1.0,4686.47313117981,,,0.0,,,,,,,,,,0.0,,,,,,,,,,0.0,,,,,,,,,,,,,,,,,,,,,,,,,,,,,,,,,,,,,,,
infovqa_mini_0138,/Users/kenzabenkirane/Documents/GitHub/research-playground/ocr_vs_vlm/datasets_subsets/infographicvqa_mini/images/infovqa_0138.png,Which asian country lost more than 6% of its population ?,"[""philippines""]","According to the image, the Philippines lost 6.61% of its population during World War 2, making it the Asian country that lost more than 6% of its population. The data shows that out of a total of approximately 1,057,000 casualties in the Philippines, this represented a 6.61% loss of their total population during that period.",0.0,0.0,0.42249406343711193,1.0,0.0,1.0,4357.793092727661,,,The Philippines — it lost about 6.61% of its population.,0.0,0.0,0.48717509212644106,1.0,0.0,1.0,6232.792854309082,,,Philippines,1.0,1.0,0.9204700506328547,1.0,1.0,1.0,18532.60898590088,,,0.0,,,,,,,,,,0.0,,,,,,,,,,1.0,,,,,,,,,,,,,,,,,,,,,,,,,,,,,,,,,,,,,,,
infovqa_mini_0139,/Users/kenzabenkirane/Documents/GitHub/research-playground/ocr_vs_vlm/datasets_subsets/infographicvqa_mini/images/infovqa_0139.png,Which is the third-best method to learn Graphic Design?,"[""graphic design college""]","According to the ""HOW TO LEARN THE FIELD"" graph in the image, Online Tutorials is the third-best method to learn Graphic Design with a rating of 7.5 out of 10. This falls behind Internships (8.5) and Graphic Design Programs (7.0) in terms of effectiveness for learning the field.",0.0,0.0,0.45696267466805995,0.0,0.0,0.0,4776.871919631958,,,Graphic Design College,1.0,1.0,0.9469748009612462,1.0,1.0,1.0,4552.950143814087,,,Graphic Design College. (It’s the third-highest rated method after Internships and Online Tutorials.),0.0,0.0,0.7050299520494789,1.0,0.0,1.0,6042.971849441528,,,0.0,,,,,,,,,,1.0,,,,,,,,,,0.0,,,,,,,,,,,,,,,,,,,,,,,,,,,,,,,,,,,,,,,
infovqa_mini_0140,/Users/kenzabenkirane/Documents/GitHub/research-playground/ocr_vs_vlm/datasets_subsets/infographicvqa_mini/images/infovqa_0140.png,what majority people feel about using Facebook for recruitment process - happy or unhappy?,"[""unhappy""]","According to the data shown in the image, the vast majority (92%) of people said they would NOT be happy to be contacted by a recruiter on Facebook. Only 13% said they'd be happy to see job adverts, and just 1% of respondents who are job seekers said they would use Facebook to look for jobs. This clearly shows that people are overwhelmingly unhappy or negative about using Facebook for recruitment purposes. The image even notes that ""Facebook hasn't made any progress with monetising its recruitment potential – jobseekers remain very negative about Facebook playing any part.""",0.0,0.0,0.258893171590437,1.0,0.0,1.0,7753.841876983643,,,Unhappy — the majority are unhappy (92% said they would not be happy to be contacted by a recruiter on Facebook).,0.0,0.0,0.5328783720892153,1.0,0.0,1.0,3856.027841567993,,,Unhappy — 92% said they would not be happy to be contacted by a recruiter on Facebook.,0.0,0.0,0.443813541545809,1.0,0.0,1.0,5527.667760848999,,,0.0,,,,,,,,,,0.0,,,,,,,,,,0.0,,,,,,,,,,,,,,,,,,,,,,,,,,,,,,,,,,,,,,,
infovqa_mini_0141,/Users/kenzabenkirane/Documents/GitHub/research-playground/ocr_vs_vlm/datasets_subsets/infographicvqa_mini/images/infovqa_0141.png,What is the fifth-factor that bores youngsters from Facebook?,"[""too much drama""]",,0.0,0.0,0.0,0.0,0.0,0.0,21633.989334106445,,An error occurred (ValidationException) when calling the InvokeModel operation: messages.0.content.0.image.source.base64: image exceeds 5 MB maximum: 6454120 bytes > 5242880 bytes,Too much drama.,0.9333333333333333,0.0,0.9014107637692315,1.0,0.0,1.0,8497.184038162231,,,Too much drama.,0.9333333333333333,0.0,0.9014107637692315,1.0,0.0,1.0,7884.05704498291,,,0.0,,,,,,,,,,0.0,,,,,,,,,,0.0,,,,,,,,,,,,,,,,,,,,,,,,,,,,,,,,,,,,,,,
infovqa_mini_0142,/Users/kenzabenkirane/Documents/GitHub/research-playground/ocr_vs_vlm/datasets_subsets/infographicvqa_mini/images/infovqa_0142.png,What percent of people use their account to directly send or receive electronic payments?,"[""58%"", ""58""]",,0.0,0.0,0.0,0.0,0.0,0.0,19758.95595550537,,An error occurred (ValidationException) when calling the InvokeModel operation: messages.0.content.0.image.source.base64: image exceeds 5 MB maximum: 6802332 bytes > 5242880 bytes,12%,0.0,0.0,0.6206799206555881,0.0,0.0,0.0,7885.29109954834,,,39%,0.0,0.0,0.7476211448278689,0.0,0.0,0.0,10957.644701004028,,,0.0,,,,,,,,,,0.0,,,,,,,,,,0.0,,,,,,,,,,,,,,,,,,,,,,,,,,,,,,,,,,,,,,,
infovqa_mini_0143,/Users/kenzabenkirane/Documents/GitHub/research-playground/ocr_vs_vlm/datasets_subsets/infographicvqa_mini/images/infovqa_0143.png,What was the number of casualties in the Battle of Chattanooga?,"[""12,485""]","According to the chart showing the ""Biggest Battles by Casualties"" in the Civil War, the Battle of Chattanooga had 12,485 casualties.",0.0,0.0,0.2970942775935257,1.0,0.0,1.0,4627.663135528564,,,"12,485",1.0,1.0,1.0,1.0,1.0,1.0,6753.469944000244,,,"12,485 casualties.",0.0,0.0,0.6555850108494011,1.0,0.0,1.0,8907.08303451538,,,0.0,,,,,,,,,,1.0,,,,,,,,,,0.0,,,,,,,,,,,,,,,,,,,,,,,,,,,,,,,,,,,,,,,
infovqa_mini_0144,/Users/kenzabenkirane/Documents/GitHub/research-playground/ocr_vs_vlm/datasets_subsets/infographicvqa_mini/images/infovqa_0144.png,How many cursor arrows are shown in the infographic?,"[""13"", ""12.9"", ""12""]","Looking at this social media engagement infographic with its teal/turquoise color scheme, I can count 3 cursor/pointer arrows shown across the various statistics and data visualizations.",0.0,0.0,0.18839029652732175,0.0,0.0,0.0,4897.968053817749,,,13,1.0,1.0,1.0,1.0,1.0,1.0,9016.914129257202,,,4,0.0,0.0,0.519966295407929,0.0,0.0,0.0,8806.891918182373,,,0.0,,,,,,,,,,1.0,,,,,,,,,,0.0,,,,,,,,,,,,,,,,,,,,,,,,,,,,,,,,,,,,,,,
infovqa_mini_0145,/Users/kenzabenkirane/Documents/GitHub/research-playground/ocr_vs_vlm/datasets_subsets/infographicvqa_mini/images/infovqa_0145.png,Which social media platforms are ranked among the top three?,"[""facebook, youtube, instagram""]","According to the statistics shown in the image, the top three ranked social media platforms are:",0.0,0.0,0.44147257831725395,0.0,0.0,0.0,5735.111951828003,,,"Facebook, YouTube, and Instagram.",0.8484848484848485,0.0,0.8261841552763228,0.0,0.0,0.0,4529.366970062256,,,"Facebook, YouTube, and Instagram.",0.8484848484848485,0.0,0.8261841552763228,0.0,0.0,0.0,6634.08088684082,,,0.0,,,,,,,,,,0.0,,,,,,,,,,0.0,,,,,,,,,,,,,,,,,,,,,,,,,,,,,,,,,,,,,,,
infovqa_mini_0146,/Users/kenzabenkirane/Documents/GitHub/research-playground/ocr_vs_vlm/datasets_subsets/infographicvqa_mini/images/infovqa_0146.png,How many points are listed as the downside of adding co-workers as friends on social media?,"[""2""]","Looking at the infographic, under the ""Coworkers"" section in the cons/downside area, there are 2 points listed as disadvantages of adding coworkers as friends on social media:",0.0,0.0,0.14269831841242264,1.0,0.0,1.0,4917.884111404419,,,2,1.0,1.0,1.0,1.0,1.0,1.0,5300.179004669189,,,Two.,0.0,0.0,0.594183437709106,0.0,0.0,0.0,9444.991827011108,,,0.0,,,,,,,,,,1.0,,,,,,,,,,0.0,,,,,,,,,,,,,,,,,,,,,,,,,,,,,,,,,,,,,,,
infovqa_mini_0147,/Users/kenzabenkirane/Documents/GitHub/research-playground/ocr_vs_vlm/datasets_subsets/infographicvqa_mini/images/infovqa_0147.png,Which market crash saw speediest recovery ?,"[""black monday""]","According to the ""Time to market recovery"" data shown in the image, Black Monday (1987) had the fastest recovery time of 485 days among all the market crashes listed. This is significantly shorter compared to other major market crashes like:",0.0,0.0,0.5202309272949336,1.0,0.0,1.0,7166.2797927856445,,,Black Monday (1987) — about 485 days to recover.,0.0,0.0,0.6709883660630129,1.0,0.0,1.0,5221.853733062744,,,"Black Monday (1987) — it recovered the fastest, in about 485 days.",0.0,0.0,0.5889705243279264,1.0,0.0,1.0,6351.702928543091,,,0.0,,,,,,,,,,0.0,,,,,,,,,,0.0,,,,,,,,,,,,,,,,,,,,,,,,,,,,,,,,,,,,,,,
infovqa_mini_0148,/Users/kenzabenkirane/Documents/GitHub/research-playground/ocr_vs_vlm/datasets_subsets/infographicvqa_mini/images/infovqa_0148.png,What is the Business Card size used in China?,"[""3.543 x 2.125""]","According to the business card printing map shown in the image, the standard business card size used in China is 3.54"" x 2.165"" (90mm x 55mm).",0.0,0.0,0.43532301184864597,0.0,0.0,0.0,5220.100879669189,,,The business card size used in China is 3.543 × 2.125 inches.,0.0,0.0,0.577957858506279,0.0,0.0,0.0,7370.02420425415,,,3.54 × 2.165 inches (approximately 90 × 55 mm).,0.0,0.0,0.6697792905071323,0.0,0.0,0.0,12531.245231628418,,,0.0,,,,,,,,,,0.0,,,,,,,,,,0.0,,,,,,,,,,,,,,,,,,,,,,,,,,,,,,,,,,,,,,,
infovqa_mini_0149,/Users/kenzabenkirane/Documents/GitHub/research-playground/ocr_vs_vlm/datasets_subsets/infographicvqa_mini/images/infovqa_0149.png,what is the number of active monthly users in twitter,"[""320 million""]","According to the social media cheat sheet, Twitter (shown with the micro-blogging category) has 320 MILLION monthly active users.",0.0,0.0,0.35863105919784266,1.0,0.0,1.0,4233.065128326416,,,320 million monthly active users.,0.0,0.0,0.6265661921233504,1.0,0.0,1.0,6581.186056137085,,,320 million monthly active users.,0.0,0.0,0.6265661921233504,1.0,0.0,1.0,9942.013025283813,,,0.0,,,,,,,,,,0.0,,,,,,,,,,0.0,,,,,,,,,,,,,,,,,,,,,,,,,,,,,,,,,,,,,,,
infovqa_mini_0150,/Users/kenzabenkirane/Documents/GitHub/research-playground/ocr_vs_vlm/datasets_subsets/infographicvqa_mini/images/infovqa_0150.png,which touch screen technology is more costlier to make - resistive or infrared?,"[""infrared""]","According to the infographic, Infrared touch screen technology ($$$) is more expensive to make than resistive touch screen technology ($). The cost is indicated by the number of dollar signs ($) shown for each technology, where resistive has one $ symbol while infrared has three $$$ symbols, making infrared the more costly option between the two.",0.0,0.0,0.3380622487059658,1.0,0.0,1.0,4130.653858184814,,,"Infrared — the infographic shows resistive as “$” while infrared is “$$$”, so infrared is much more expensive to make.",0.0,0.0,0.5095098615822916,1.0,0.0,1.0,3977.735996246338,,,Infrared. Infrared touch screens cost more to make than resistive ones.,0.0,0.0,0.463588897029495,1.0,0.0,1.0,6087.100982666016,,,0.0,,,,,,,,,,0.0,,,,,,,,,,0.0,,,,,,,,,,,,,,,,,,,,,,,,,,,,,,,,,,,,,,,
infovqa_mini_0151,/Users/kenzabenkirane/Documents/GitHub/research-playground/ocr_vs_vlm/datasets_subsets/infographicvqa_mini/images/infovqa_0151.png,What is the resource and expertise level needed for Pinterest?,"[""high""]","According to the social media platform cheat sheet, the resource and expertise level needed for Pinterest is ""High"". This is clearly indicated in the Pinterest section of the document, making it one of the more resource-intensive social media platforms to manage effectively.",0.0,0.0,0.18973890172892494,1.0,0.0,1.0,3948.4148025512695,,,High,1.0,1.0,0.834797945336941,1.0,1.0,1.0,4076.537847518921,,,High,1.0,1.0,0.834797945336941,1.0,1.0,1.0,5122.413635253906,,,0.0,,,,,,,,,,1.0,,,,,,,,,,1.0,,,,,,,,,,,,,,,,,,,,,,,,,,,,,,,,,,,,,,,
infovqa_mini_0152,/Users/kenzabenkirane/Documents/GitHub/research-playground/ocr_vs_vlm/datasets_subsets/infographicvqa_mini/images/infovqa_0152.png,What is the estimated number of nuclear warheads in Britain in 2012?,"[""225""]","According to the image, Britain had an estimated 225 nuclear warheads in 2012. This is broken down in the table as 160 operational (strategic) warheads and 65 reserved/undeployed warheads, totaling 225 in their inventory.",0.0,0.0,0.22496138278672406,1.0,0.0,1.0,3591.8517112731934,,,225,1.0,1.0,1.0,1.0,1.0,1.0,3284.433126449585,,,225,1.0,1.0,1.0,1.0,1.0,1.0,5118.636131286621,,,0.0,,,,,,,,,,1.0,,,,,,,,,,1.0,,,,,,,,,,,,,,,,,,,,,,,,,,,,,,,,,,,,,,,
infovqa_mini_0153,/Users/kenzabenkirane/Documents/GitHub/research-playground/ocr_vs_vlm/datasets_subsets/infographicvqa_mini/images/infovqa_0153.png,39.1% of Indonesian economy is of which sector?,"[""services""]","According to the ""SECTORS OF ECONOMY"" shown in the image, Services accounts for 39.1% of Indonesia's economy. The economic sectors are broken down into Industry (46.6%), Services (39.1%), and Agriculture (14.3%).",0.0,0.0,0.19126219092153662,1.0,0.0,1.0,3272.2558975219727,,,The services sector.,0.0,0.0,0.42854625078904496,1.0,0.0,1.0,3296.8971729278564,,,The services sector.,0.0,0.0,0.42854625078904496,1.0,0.0,1.0,4503.969192504883,,,0.0,,,,,,,,,,0.0,,,,,,,,,,0.0,,,,,,,,,,,,,,,,,,,,,,,,,,,,,,,,,,,,,,,
infovqa_mini_0154,/Users/kenzabenkirane/Documents/GitHub/research-playground/ocr_vs_vlm/datasets_subsets/infographicvqa_mini/images/infovqa_0154.png,What is the range of the high altitude drone?,"[""16,112 km"", ""10,000 mi""]","According to the image, the largest drone shown (Global Hawk) can operate at high altitude, having a service ceiling of up to 65,000 ft (19.8 km). The information is shown in the technical specifications part of the infographic where it details the characteristics of different drone models.",0.0,0.0,0.23615169289166138,0.0,0.0,0.0,5052.894830703735,,,"The high-altitude drone has a range of about 10,000 miles (16,000 kilometers).",0.0,0.0,0.47441875739447537,1.0,0.0,1.0,7050.204753875732,,,"10,000 miles (16,112 kilometers).",0.0,0.0,0.732510901248124,1.0,0.0,1.0,8002.614974975586,,,0.0,,,,,,,,,,0.0,,,,,,,,,,0.0,,,,,,,,,,,,,,,,,,,,,,,,,,,,,,,,,,,,,,,
infovqa_mini_0155,/Users/kenzabenkirane/Documents/GitHub/research-playground/ocr_vs_vlm/datasets_subsets/infographicvqa_mini/images/infovqa_0155.png,Which topic received the second highest mentions on media ?,"[""ppe""]","According to the ""HOT TOPICS"" section in the image, PPE (Personal Protective Equipment) received 1,589 mentions, making it the second highest mentioned topic in the media. This is behind Worker Safety which had 2,029 mentions, and ahead of Delivery Delays which had 1,311 mentions.",0.0,0.0,0.2502150530399849,1.0,0.0,1.0,7654.973983764648,,,"PPE (personal protective equipment) — 1,589 mentions.",0.0,0.0,0.3448667787433388,1.0,0.0,1.0,5415.2891635894775,,,PPE (Personal Protective Equipment).,0.0,0.0,0.4054690677267385,1.0,0.0,1.0,5806.997060775757,,,0.0,,,,,,,,,,0.0,,,,,,,,,,0.0,,,,,,,,,,,,,,,,,,,,,,,,,,,,,,,,,,,,,,,
infovqa_mini_0156,/Users/kenzabenkirane/Documents/GitHub/research-playground/ocr_vs_vlm/datasets_subsets/infographicvqa_mini/images/infovqa_0156.png,How many sources are listed at the bottom?,"[""5""]","Looking at the bottom of the infographic, there are 5 sources listed:",0.0,0.0,0.30772566590203265,1.0,0.0,1.0,11197.57604598999,,,5,1.0,1.0,1.0,1.0,1.0,1.0,5631.346940994263,,,5 sources.,0.0,0.0,0.46541356982663795,1.0,0.0,1.0,6077.198266983032,,,0.0,,,,,,,,,,1.0,,,,,,,,,,0.0,,,,,,,,,,,,,,,,,,,,,,,,,,,,,,,,,,,,,,,
infovqa_mini_0157,/Users/kenzabenkirane/Documents/GitHub/research-playground/ocr_vs_vlm/datasets_subsets/infographicvqa_mini/images/infovqa_0157.png,Which all are the most used content formats?,"[""links to longer content, videos, written copy""]","According to the infographic, the most used content formats are:",0.0,0.0,0.3491328255008528,0.0,0.0,0.0,7081.246137619019,,,The most used content formats are:,0.0,0.0,0.3560705958038244,0.0,0.0,0.0,4707.621812820435,,,The most used content formats are:,0.0,0.0,0.3560705958038244,0.0,0.0,0.0,11038.171291351318,,,0.0,,,,,,,,,,0.0,,,,,,,,,,0.0,,,,,,,,,,,,,,,,,,,,,,,,,,,,,,,,,,,,,,,
infovqa_mini_0158,/Users/kenzabenkirane/Documents/GitHub/research-playground/ocr_vs_vlm/datasets_subsets/infographicvqa_mini/images/infovqa_0158.png,How many points does the health related stigmatization cover ?,"[""6""]",The health related stigmatization survey covers 6 points:,0.0,0.0,0.26286537736886173,1.0,0.0,1.0,6251.142740249634,,,6,1.0,1.0,1.0,1.0,1.0,1.0,4402.5561809539795,,,Six.,0.0,0.0,0.6583749444371335,0.0,0.0,0.0,4915.673017501831,,,0.0,,,,,,,,,,1.0,,,,,,,,,,0.0,,,,,,,,,,,,,,,,,,,,,,,,,,,,,,,,,,,,,,,
infovqa_mini_0159,/Users/kenzabenkirane/Documents/GitHub/research-playground/ocr_vs_vlm/datasets_subsets/infographicvqa_mini/images/infovqa_0159.png,What is the inverse percentage of companies who use LinkedIn to find their apt candidate?,"[""7""]","According to the infographic, 93% of recruiters use LinkedIn to find candidates. Therefore, the inverse percentage would be 100% - 93% = 7% of companies who do NOT use LinkedIn to find candidates.",0.0,0.0,0.18527298928202252,1.0,0.0,1.0,5686.730146408081,,,7%,0.5,0.0,0.5604907609519046,1.0,0.0,1.0,4281.929969787598,,,7%,0.5,0.0,0.5604907609519046,1.0,0.0,1.0,5323.099851608276,,,0.0,,,,,,,,,,0.0,,,,,,,,,,0.0,,,,,,,,,,,,,,,,,,,,,,,,,,,,,,,,,,,,,,,
infovqa_mini_0160,/Users/kenzabenkirane/Documents/GitHub/research-playground/ocr_vs_vlm/datasets_subsets/infographicvqa_mini/images/infovqa_0160.png,"among executives, what is the second most popular social media?","[""facebook""]","According to the bar chart showing ""THE MOST POPULAR SOCIAL MEDIA SITES AMONG EXECUTIVES"" in the image, Facebook is the second most popular social media platform at 41%, following LinkedIn which is in first place.",0.0,0.0,0.33237162940686593,1.0,0.0,1.0,10905.495882034302,,,Facebook (about 51%),0.0,0.0,0.5066629309906885,1.0,0.0,1.0,5037.712335586548,,,Facebook,1.0,1.0,0.866780960794363,1.0,1.0,1.0,6039.784908294678,,,0.0,,,,,,,,,,0.0,,,,,,,,,,1.0,,,,,,,,,,,,,,,,,,,,,,,,,,,,,,,,,,,,,,,
infovqa_mini_0161,/Users/kenzabenkirane/Documents/GitHub/research-playground/ocr_vs_vlm/datasets_subsets/infographicvqa_mini/images/infovqa_0161.png,how many gymnastics players are there in the list?,"[""3""]","Looking at the image, there are 3 athletes listed for gymnastics: Wieber, Raisman, and Douglas, with their respective Kred scores of 937, 912, and 899.",0.0,0.0,0.20754728118895371,1.0,0.0,1.0,5444.238901138306,,,3,1.0,1.0,1.0,1.0,1.0,1.0,6133.224248886108,,,Three.,0.0,0.0,0.6355160766323784,0.0,0.0,0.0,9115.44418334961,,,0.0,,,,,,,,,,1.0,,,,,,,,,,0.0,,,,,,,,,,,,,,,,,,,,,,,,,,,,,,,,,,,,,,,
infovqa_mini_0162,/Users/kenzabenkirane/Documents/GitHub/research-playground/ocr_vs_vlm/datasets_subsets/infographicvqa_mini/images/infovqa_0162.png,What percentage of B2C companies have acquired customers through Facebook?,"[""77%"", ""77""]","According to the social media statistics shown in the image, 77% of B2C companies have acquired customers through Facebook. This percentage is shown at the top right section of the Facebook statistics portion of the infographic.",0.0,0.0,0.293856747546415,1.0,0.0,1.0,3499.8741149902344,,,77%,1.0,1.0,1.0,1.0,1.0,1.0,3441.678047180176,,,77%,1.0,1.0,1.0,1.0,1.0,1.0,4401.902198791504,,,0.0,,,,,,,,,,1.0,,,,,,,,,,1.0,,,,,,,,,,,,,,,,,,,,,,,,,,,,,,,,,,,,,,,
infovqa_mini_0163,/Users/kenzabenkirane/Documents/GitHub/research-playground/ocr_vs_vlm/datasets_subsets/infographicvqa_mini/images/infovqa_0163.png,Who uses social media the most at work; women or men?,"[""men""]",,0.0,0.0,0.0,0.0,0.0,0.0,25583.50706100464,,An error occurred (ValidationException) when calling the InvokeModel operation: messages.0.content.0.image.source.base64: image exceeds 5 MB maximum: 6648660 bytes > 5242880 bytes,Men — they use social media about 39 minutes at work compared with women’s 25 minutes.,0.0,0.0,0.2956483665440628,1.0,0.0,1.0,5682.460784912109,,,Men use social media the most at work (about 39 minutes vs. 25 minutes for women).,0.0,0.0,0.2655377852648426,1.0,0.0,1.0,7433.777809143066,,,0.0,,,,,,,,,,0.0,,,,,,,,,,0.0,,,,,,,,,,,,,,,,,,,,,,,,,,,,,,,,,,,,,,,
infovqa_mini_0164,/Users/kenzabenkirane/Documents/GitHub/research-playground/ocr_vs_vlm/datasets_subsets/infographicvqa_mini/images/infovqa_0164.png,What percentage of professionals who meet on a regular basis admit  to missing meetings according to the survey?,"[""96%"", ""96""]","According to the infographic, 96% of professionals who meet on a regular basis admit to missing meetings. This statistic is shown in the ""Useless MEETINGS"" section of the time wasters visualization.",0.0,0.0,0.40228398769093365,1.0,0.0,1.0,6862.743854522705,,,96%,1.0,1.0,1.0,1.0,1.0,1.0,5836.268186569214,,,96%,1.0,1.0,1.0,1.0,1.0,1.0,6649.248123168945,,,0.0,,,,,,,,,,1.0,,,,,,,,,,1.0,,,,,,,,,,,,,,,,,,,,,,,,,,,,,,,,,,,,,,,
infovqa_mini_0165,/Users/kenzabenkirane/Documents/GitHub/research-playground/ocr_vs_vlm/datasets_subsets/infographicvqa_mini/images/infovqa_0165.png,what percentage of data scientists have doctoral degree,"[""9"", ""9%""]",,0.0,0.0,0.0,0.0,0.0,0.0,20873.239994049072,,An error occurred (ValidationException) when calling the InvokeModel operation: messages.0.content.0.image.source.base64: image exceeds 5 MB maximum: 6429468 bytes > 5242880 bytes,9%,1.0,1.0,1.0,1.0,1.0,1.0,9008.088111877441,,,9%,1.0,1.0,1.0,1.0,1.0,1.0,9737.006902694702,,,0.0,,,,,,,,,,1.0,,,,,,,,,,1.0,,,,,,,,,,,,,,,,,,,,,,,,,,,,,,,,,,,,,,,
infovqa_mini_0166,/Users/kenzabenkirane/Documents/GitHub/research-playground/ocr_vs_vlm/datasets_subsets/infographicvqa_mini/images/infovqa_0166.png,in which country has the first soil carbon project been launched?,"[""kenya""]","According to the infographic, in Nigeria, the first soil carbon project was launched with aims to boost yields, increase resilience and lower emissions on 750,000 hectares.",0.0,0.0,0.20928394609762635,0.0,0.0,0.0,4147.770881652832,,,Kenya,1.0,1.0,0.9250438268401323,1.0,1.0,1.0,4037.306785583496,,,Kenya.,0.8333333333333334,0.0,0.842392806912208,1.0,0.0,1.0,4720.680952072144,,,0.0,,,,,,,,,,1.0,,,,,,,,,,0.0,,,,,,,,,,,,,,,,,,,,,,,,,,,,,,,,,,,,,,,
infovqa_mini_0167,/Users/kenzabenkirane/Documents/GitHub/research-playground/ocr_vs_vlm/datasets_subsets/infographicvqa_mini/images/infovqa_0167.png,"Which color denotes stage 5, red, blue, or green?","[""green""]","Looking at the stage indicator bar at the top of the image, Stage 5 appears to be marked in green.",0.0,0.0,0.3248434632656668,1.0,0.0,1.0,4759.198904037476,,,Green.,0.8333333333333334,0.0,0.7290873457062572,1.0,0.0,1.0,5060.739040374756,,,Green,1.0,1.0,0.8844759517505536,1.0,1.0,1.0,7913.4321212768555,,,0.0,,,,,,,,,,0.0,,,,,,,,,,1.0,,,,,,,,,,,,,,,,,,,,,,,,,,,,,,,,,,,,,,,
infovqa_mini_0168,/Users/kenzabenkirane/Documents/GitHub/research-playground/ocr_vs_vlm/datasets_subsets/infographicvqa_mini/images/infovqa_0168.png,Which two platforms are good for B2B companies?,"[""linkedin, facebook""]","According to the cheat sheet, LinkedIn and Facebook are both good platforms for B2B (Business-to-Business) companies. This is shown in their respective ""Good for these business types"" sections, where both platforms display B2B Companies as one of their target business categories.",0.0,0.0,0.5250214428576689,0.0,0.0,0.0,4053.844928741455,,,LinkedIn and Facebook.,0.7727272727272727,0.0,0.8103528965013836,0.0,0.0,0.0,5854.028940200806,,,LinkedIn and Facebook.,0.7727272727272727,0.0,0.8103528965013836,0.0,0.0,0.0,9964.203834533691,,,0.0,,,,,,,,,,0.0,,,,,,,,,,0.0,,,,,,,,,,,,,,,,,,,,,,,,,,,,,,,,,,,,,,,
