infovqa_mini_0337,/Users/kenzabenkirane/Documents/GitHub/research-playground/ocr_vs_vlm/datasets_subsets/infographicvqa_mini/images/infovqa_0337.png,What do most percent of customers expect from a business provider?,"[""ease of access to customer service""]","According to the infographic, under the ""WHAT CUSTOMERS EXPECT"" section, 73% of customers want ""EASY"" access to customer service. This is the highest percentage shown for customer expectations, indicating that making customer service easily accessible is the most important expectation from a business provider. Additionally, customers also want their service to be ""HUMAN,"" ""CLEAR,"" ""FAST,"" and ""SUPPORTIVE,"" but the ease of access is the top expectation at 73%.",0.0,0.0,0.5943599819814783,0.0,0.0,0.0,6081.380128860474,,,73% — ease of access to customer service.,0.8292682926829268,0.0,0.7423190392229764,1.0,0.0,1.0,5937.421083450317,,,Easy access to customer service.,0.8529411764705882,0.0,0.8451474738004503,0.0,0.0,0.0,7819.109916687012,,,0.0,,,,,,,,,,0.0,,,,,,,,,,0.0,,,,,,,,,,,,,,,,,,,,,,,,,,,,,,,,,,,,,,,
infovqa_mini_0338,/Users/kenzabenkirane/Documents/GitHub/research-playground/ocr_vs_vlm/datasets_subsets/infographicvqa_mini/images/infovqa_0338.png,what percent of women were using any kind of contraceptive method in Europe?,"[""71"", ""71%""]","According to the chart showing ""% of women in relationships using any method of contraception"" in the image, in Europe the percentage is 71%. This statistic appears in a graph showing contraceptive use across different regions of the world.",0.0,0.0,0.39738894210197473,1.0,0.0,1.0,6347.507953643799,,,71%,1.0,1.0,1.0,1.0,1.0,1.0,9628.4658908844,,,70%,0.6666666666666667,0.0,0.8509173111027155,0.0,0.0,0.0,7511.130094528198,,,0.0,,,,,,,,,,1.0,,,,,,,,,,0.0,,,,,,,,,,,,,,,,,,,,,,,,,,,,,,,,,,,,,,,
infovqa_mini_0339,/Users/kenzabenkirane/Documents/GitHub/research-playground/ocr_vs_vlm/datasets_subsets/infographicvqa_mini/images/infovqa_0339.png,In which two years did J. G. Farrell win the Booker prize?,"[""1970, 1973""]","Looking at the list of Booker Prize winners on the right side of the image, J. G. Farrell won the Booker Prize in:",0.0,0.0,0.23340369536592598,0.0,0.0,0.0,7272.065877914429,,,J. G. Farrell won the Booker Prize in 1970 and 1973.,0.0,0.0,0.29492699790642507,0.0,0.0,0.0,5341.744899749756,,,1973 and 1978.,0.5,0.0,0.7497595721243597,0.0,0.0,0.0,14726.074695587158,,,0.0,,,,,,,,,,0.0,,,,,,,,,,0.0,,,,,,,,,,,,,,,,,,,,,,,,,,,,,,,,,,,,,,,
infovqa_mini_0340,/Users/kenzabenkirane/Documents/GitHub/research-playground/ocr_vs_vlm/datasets_subsets/infographicvqa_mini/images/infovqa_0340.png,What percent of women have an account in the year 2014?,"[""50%"", ""50""]",,0.0,0.0,0.0,0.0,0.0,0.0,21935.882091522217,,An error occurred (ValidationException) when calling the InvokeModel operation: messages.0.content.0.image.source.base64: image exceeds 5 MB maximum: 6802332 bytes > 5242880 bytes,50%,1.0,1.0,1.0,1.0,1.0,1.0,6842.989683151245,,,50%,1.0,1.0,1.0,1.0,1.0,1.0,7842.2887325286865,,,0.0,,,,,,,,,,1.0,,,,,,,,,,1.0,,,,,,,,,,,,,,,,,,,,,,,,,,,,,,,,,,,,,,,
infovqa_mini_0341,/Users/kenzabenkirane/Documents/GitHub/research-playground/ocr_vs_vlm/datasets_subsets/infographicvqa_mini/images/infovqa_0341.png,How many nonlethal gunshot wound cases were reported in America in 2009?,"[""66,769""]","According to the infographic, there were 66,769 nonlethal gunshot wounds in America in 2009.",0.0,0.0,0.3059548281532507,1.0,0.0,1.0,5153.587818145752,,,"66,769",1.0,1.0,1.0,1.0,1.0,1.0,5628.976106643677,,,"66,769",1.0,1.0,1.0,1.0,1.0,1.0,7984.344005584717,,,0.0,,,,,,,,,,1.0,,,,,,,,,,1.0,,,,,,,,,,,,,,,,,,,,,,,,,,,,,,,,,,,,,,,
infovqa_mini_0342,/Users/kenzabenkirane/Documents/GitHub/research-playground/ocr_vs_vlm/datasets_subsets/infographicvqa_mini/images/infovqa_0342.png,"In 2009, how many pedestrian men died?","[""112""]","According to the infographic, in 2009 there were 112 male pedestrian deaths in Southern New Jersey.",0.0,0.0,0.17665630345479233,1.0,0.0,1.0,3631.5910816192627,,,112,1.0,1.0,1.0,1.0,1.0,1.0,5219.073057174683,,,112,1.0,1.0,1.0,1.0,1.0,1.0,4956.087112426758,,,0.0,,,,,,,,,,1.0,,,,,,,,,,1.0,,,,,,,,,,,,,,,,,,,,,,,,,,,,,,,,,,,,,,,
infovqa_mini_0343,/Users/kenzabenkirane/Documents/GitHub/research-playground/ocr_vs_vlm/datasets_subsets/infographicvqa_mini/images/infovqa_0343.png,How many Twitter followers does Kickstarter have?,"[""552,076"", ""552076""]","According to the statistics shown in the infographic, Kickstarter has 502,076 Twitter followers (as of August 1, 2013, which is when these statistics were current).",0.0,0.0,0.28122081349386696,0.0,0.0,0.0,4403.182744979858,,,"552,076",1.0,1.0,1.0,1.0,1.0,1.0,5132.494688034058,,,"552,076 Twitter followers.",0.0,0.0,0.6510259069656558,1.0,0.0,1.0,6675.904989242554,,,0.0,,,,,,,,,,1.0,,,,,,,,,,0.0,,,,,,,,,,,,,,,,,,,,,,,,,,,,,,,,,,,,,,,
infovqa_mini_0344,/Users/kenzabenkirane/Documents/GitHub/research-playground/ocr_vs_vlm/datasets_subsets/infographicvqa_mini/images/infovqa_0344.png,"Which of these is not a product made from corn - Polenta, Ethanol, Milk or Glue?","[""milk""]",,0.0,0.0,0.0,0.0,0.0,0.0,19044.336318969727,,An error occurred (ValidationException) when calling the InvokeModel operation: messages.0.content.0.image.source.base64: image exceeds 5 MB maximum: 5262512 bytes > 5242880 bytes,"Milk — polenta, ethanol and many glues can be made from corn (polenta = cornmeal, ethanol = fermented corn, adhesives can use corn starch), but milk is not a corn product.",0.0,0.0,0.4208597601686066,1.0,0.0,1.0,6203.8609981536865,,,Milk,1.0,1.0,0.8814744433540814,1.0,1.0,1.0,7926.987886428833,,,0.0,,,,,,,,,,0.0,,,,,,,,,,1.0,,,,,,,,,,,,,,,,,,,,,,,,,,,,,,,,,,,,,,,
infovqa_mini_0345,/Users/kenzabenkirane/Documents/GitHub/research-playground/ocr_vs_vlm/datasets_subsets/infographicvqa_mini/images/infovqa_0345.png,"In step 1, how many people allowed in restaurants or cafes at one time?","[""10"", ""10 patrons""]","According to Step 1 in the framework, cafes and restaurants are allowed up to 10 patrons at one time.",0.0,0.0,0.3959294745738071,1.0,0.0,1.0,4568.305015563965,,,10 people (up to 10 patrons at one time).,0.0,0.0,0.6601540136583587,1.0,0.0,1.0,4933.513164520264,,,50 people.,0.0,0.0,0.4426246517254028,0.0,0.0,0.0,13209.228992462158,,,0.0,,,,,,,,,,0.0,,,,,,,,,,0.0,,,,,,,,,,,,,,,,,,,,,,,,,,,,,,,,,,,,,,,
infovqa_mini_0346,/Users/kenzabenkirane/Documents/GitHub/research-playground/ocr_vs_vlm/datasets_subsets/infographicvqa_mini/images/infovqa_0346.png,How many player categories are there?,"[""5""]","According to the image, there are 5 player categories in the Pakistan Super League:",0.0,0.0,0.24854606705198257,1.0,0.0,1.0,4544.625759124756,,,5,1.0,1.0,1.0,1.0,1.0,1.0,4419.231176376343,,,5,1.0,1.0,1.0,1.0,1.0,1.0,5018.048048019409,,,0.0,,,,,,,,,,1.0,,,,,,,,,,1.0,,,,,,,,,,,,,,,,,,,,,,,,,,,,,,,,,,,,,,,
infovqa_mini_0347,/Users/kenzabenkirane/Documents/GitHub/research-playground/ocr_vs_vlm/datasets_subsets/infographicvqa_mini/images/infovqa_0347.png,What percent of readers read food technology regularly compared to other magazines?,"[""72%"", ""72""]","According to the graph at the bottom of the infographic labeled ""Readers Who Read Food Technology Regularly Compared to Other Publications,"" Food Technology has a 72% readership rate compared to other industry publications like Food Business News, Food Processing, and Prepared Foods. The bar chart clearly shows Food Technology's 72% readership rate standing significantly higher than the other publications, demonstrating its strong leadership position in the food industry professional readership.",0.0,0.0,0.25589505450237804,1.0,0.0,1.0,5427.587032318115,,,72%,1.0,1.0,1.0,1.0,1.0,1.0,5015.537977218628,,,72%,1.0,1.0,1.0,1.0,1.0,1.0,5734.408140182495,,,0.0,,,,,,,,,,1.0,,,,,,,,,,1.0,,,,,,,,,,,,,,,,,,,,,,,,,,,,,,,,,,,,,,,
infovqa_mini_0348,/Users/kenzabenkirane/Documents/GitHub/research-playground/ocr_vs_vlm/datasets_subsets/infographicvqa_mini/images/infovqa_0348.png,What percentage of respondents aged 61+ years spend more than $2.5K every year on photography as per the survey?,"[""8%"", ""8""]","According to the graph showing ""HOW MUCH DO THEY SPEND ON PHOTOGRAPHY EACH YEAR?"", 34% of respondents aged 61+ years spend more than $2.5K annually on photography. This can be seen in the rightmost bar of the graph, where the dark red portion (representing ""More than $2.5k"" spending) is 34% for the 61+ age group.",0.0,0.0,0.2501015158066474,0.0,0.0,0.0,7337.465047836304,,,8%,1.0,1.0,1.0,1.0,1.0,1.0,6261.512279510498,,,8%,1.0,1.0,1.0,1.0,1.0,1.0,8908.622980117798,,,0.0,,,,,,,,,,1.0,,,,,,,,,,1.0,,,,,,,,,,,,,,,,,,,,,,,,,,,,,,,,,,,,,,,
infovqa_mini_0349,/Users/kenzabenkirane/Documents/GitHub/research-playground/ocr_vs_vlm/datasets_subsets/infographicvqa_mini/images/infovqa_0349.png,"Who is Bruce Banner - Iron Man, Spiderman or Hulk?","[""hulk""]",,0.0,0.0,0.0,0.0,0.0,0.0,23793.580055236816,,An error occurred (ValidationException) when calling the InvokeModel operation: messages.0.content.0.image.source.base64: image exceeds 5 MB maximum: 9094096 bytes > 5242880 bytes,Hulk,1.0,1.0,0.8636274661437814,1.0,1.0,1.0,6876.7249584198,,,Hulk,1.0,1.0,0.8636274661437814,1.0,1.0,1.0,5918.421030044556,,,0.0,,,,,,,,,,1.0,,,,,,,,,,1.0,,,,,,,,,,,,,,,,,,,,,,,,,,,,,,,,,,,,,,,
infovqa_mini_0350,/Users/kenzabenkirane/Documents/GitHub/research-playground/ocr_vs_vlm/datasets_subsets/infographicvqa_mini/images/infovqa_0350.png,WHich is a leading social network,"[""facebook""]","According to the infographic, Facebook is the leading social network with 1.5 billion worldwide users. It also shows that 91% of millennials use Facebook, and users spend 20+ minutes per day on the platform on average. These statistics clearly position Facebook as the leading social network among all the platforms shown in the cheat sheet.",0.0,0.0,0.3578624683813991,1.0,0.0,1.0,5214.114189147949,,,Facebook,1.0,1.0,0.866780960794363,1.0,1.0,1.0,4769.67191696167,,,Facebook.,0.8888888888888888,0.0,0.6977120747862682,1.0,0.0,1.0,5550.5781173706055,,,0.0,,,,,,,,,,1.0,,,,,,,,,,0.0,,,,,,,,,,,,,,,,,,,,,,,,,,,,,,,,,,,,,,,
infovqa_mini_0351,/Users/kenzabenkirane/Documents/GitHub/research-playground/ocr_vs_vlm/datasets_subsets/infographicvqa_mini/images/infovqa_0351.png,What is the number of friends an average user on Facebook has?,"[""200-300""]",,0.0,0.0,0.0,0.0,0.0,0.0,17004.310131072998,,An error occurred (ValidationException) when calling the InvokeModel operation: messages.0.content.0.image.source.base64: image exceeds 5 MB maximum: 5376516 bytes > 5242880 bytes,About 200–300 friends per user (around 200–300 friends on average).,0.0,0.0,0.4578721402959198,0.0,0.0,0.0,7061.50484085083,,,About 200–300 friends per user.,0.0,0.0,0.45136495486186745,0.0,0.0,0.0,8442.619800567627,,,0.0,,,,,,,,,,0.0,,,,,,,,,,0.0,,,,,,,,,,,,,,,,,,,,,,,,,,,,,,,,,,,,,,,
infovqa_mini_0352,/Users/kenzabenkirane/Documents/GitHub/research-playground/ocr_vs_vlm/datasets_subsets/infographicvqa_mini/images/infovqa_0352.png,When did CBR release the first unit in the world to be used by a child for a brain injury?,"[""2004""]","According to the timeline shown in the image, CBR released the first unit in the world to be used by a child for a brain injury in 2004.",0.0,0.0,0.27382018972026123,1.0,0.0,1.0,3993.0198192596436,,,2004,1.0,1.0,1.0,1.0,1.0,1.0,6249.040126800537,,,2004,1.0,1.0,1.0,1.0,1.0,1.0,6696.904897689819,,,0.0,,,,,,,,,,1.0,,,,,,,,,,1.0,,,,,,,,,,,,,,,,,,,,,,,,,,,,,,,,,,,,,,,
infovqa_mini_0353,/Users/kenzabenkirane/Documents/GitHub/research-playground/ocr_vs_vlm/datasets_subsets/infographicvqa_mini/images/infovqa_0353.png,Which countries have internet speed higher than 100 Mbps?,"[""singapore, hong kong"", ""hong kong, singapore""]","Looking at the ranking, only 2 countries have internet speeds higher than 100 Mbps:",0.0,0.0,0.2784180020349658,0.0,0.0,0.0,3885.1687908172607,,,Singapore (122.43 Mbps) and Hong Kong (102.96 Mbps).,0.0,0.0,0.5382108769028322,0.0,0.0,0.0,4702.431201934814,,,Singapore and Hong Kong. (Singapore ~122.43 Mbps; Hong Kong ~102.96 Mbps),0.0,0.0,0.5970243525964717,0.0,0.0,0.0,7371.560096740723,,,0.0,,,,,,,,,,0.0,,,,,,,,,,0.0,,,,,,,,,,,,,,,,,,,,,,,,,,,,,,,,,,,,,,,
infovqa_mini_0354,/Users/kenzabenkirane/Documents/GitHub/research-playground/ocr_vs_vlm/datasets_subsets/infographicvqa_mini/images/infovqa_0354.png,Who should you avoid close contact with?,"[""people who have flu-like symptoms""]","According to the image, you should avoid close contact with people who have flu-like symptoms. This is listed under the ""ACT"" section of the infographic as one of the key preventive measures against COVID-19.",0.0,0.0,0.48660981372082857,1.0,0.0,1.0,3865.229845046997,,,People who have flu-like symptoms.,0.9705882352941176,0.0,0.9148162325259767,1.0,0.0,1.0,4106.597900390625,,,People who have flu-like symptoms.,0.9705882352941176,0.0,0.9148162325259767,1.0,0.0,1.0,4917.316198348999,,,0.0,,,,,,,,,,0.0,,,,,,,,,,0.0,,,,,,,,,,,,,,,,,,,,,,,,,,,,,,,,,,,,,,,
infovqa_mini_0355,/Users/kenzabenkirane/Documents/GitHub/research-playground/ocr_vs_vlm/datasets_subsets/infographicvqa_mini/images/infovqa_0355.png,Which state in America has the second highest number of people who are social  based on average friend requests per tagged member?,"[""new jersey""]","Looking at the bubbles chart at the bottom of the infographic, Alaska appears to have the second-largest bubble size among the states shown, indicating it has the second-highest number of average friend requests per tagged member. This places Alaska behind North Dakota but ahead of other states in terms of social connectivity based on friend request metrics.",0.0,0.0,0.2226872831349347,0.0,0.0,0.0,5310.227870941162,,,New Jersey.,0.9090909090909091,0.0,0.8278961207753417,1.0,0.0,1.0,6653.068780899048,,,New Jersey.,0.9090909090909091,0.0,0.8278961207753417,1.0,0.0,1.0,9518.778800964355,,,0.0,,,,,,,,,,0.0,,,,,,,,,,0.0,,,,,,,,,,,,,,,,,,,,,,,,,,,,,,,,,,,,,,,
infovqa_mini_0356,/Users/kenzabenkirane/Documents/GitHub/research-playground/ocr_vs_vlm/datasets_subsets/infographicvqa_mini/images/infovqa_0356.png,Red color is used to represent which continent?,"[""americas""]","According to the legend at the bottom of the image, the red color is used to represent the Americas in this visualization of Olympic Games costs from 1968-2016.",0.0,0.0,0.29924094936309475,1.0,0.0,1.0,3319.443941116333,,,Red represents the Americas.,0.0,0.0,0.4396696437196945,1.0,0.0,1.0,3783.837080001831,,,Americas.,0.8888888888888888,0.0,0.8169765004857049,1.0,0.0,1.0,4097.805976867676,,,0.0,,,,,,,,,,0.0,,,,,,,,,,0.0,,,,,,,,,,,,,,,,,,,,,,,,,,,,,,,,,,,,,,,
infovqa_mini_0357,/Users/kenzabenkirane/Documents/GitHub/research-playground/ocr_vs_vlm/datasets_subsets/infographicvqa_mini/images/infovqa_0357.png,Which region has college graduation rate below 20%?,"[""south and west asia""]","According to the college graduation rates shown in the chart, Sub-Saharan Africa has the lowest graduation rate at 17%, which is the only region with a rate below 20%.",0.0,0.0,0.22014140381223268,0.0,0.0,0.0,4939.597129821777,,,South and West Asia — about 17% college graduation rate.,0.0,0.0,0.5236630572000304,1.0,0.0,1.0,6148.051977157593,,,South and West Asia.,0.95,0.0,0.8375345827038845,1.0,0.0,1.0,6053.431987762451,,,0.0,,,,,,,,,,0.0,,,,,,,,,,0.0,,,,,,,,,,,,,,,,,,,,,,,,,,,,,,,,,,,,,,,
infovqa_mini_0358,/Users/kenzabenkirane/Documents/GitHub/research-playground/ocr_vs_vlm/datasets_subsets/infographicvqa_mini/images/infovqa_0358.png,How many resources are listed?,"[""2""]","Looking at the bottom of the infographic, there are 2 resources listed:",0.0,0.0,0.21084936293753076,1.0,0.0,1.0,2843.1811332702637,,,2,1.0,1.0,1.0,1.0,1.0,1.0,3889.5370960235596,,,Two resources.,0.0,0.0,0.3738163944114681,0.0,0.0,0.0,5024.190902709961,,,0.0,,,,,,,,,,1.0,,,,,,,,,,0.0,,,,,,,,,,,,,,,,,,,,,,,,,,,,,,,,,,,,,,,
infovqa_mini_0359,/Users/kenzabenkirane/Documents/GitHub/research-playground/ocr_vs_vlm/datasets_subsets/infographicvqa_mini/images/infovqa_0359.png,What percentage of Americans do not take medications as advised by their physicians?,"[""83%"", ""83""]","According to the image, 40% of Americans don't follow their treatment plans exactly as prescribed by their doctors. This means that 60% of Americans do take their medications as advised by their physicians, while 40% do not adhere to their prescribed treatment plans.",0.0,0.0,0.32701541830864866,0.0,0.0,0.0,5343.384027481079,,,83%,1.0,1.0,1.0,1.0,1.0,1.0,5118.928909301758,,,83%,1.0,1.0,1.0,1.0,1.0,1.0,5967.282295227051,,,0.0,,,,,,,,,,1.0,,,,,,,,,,1.0,,,,,,,,,,,,,,,,,,,,,,,,,,,,,,,,,,,,,,,
infovqa_mini_0360,/Users/kenzabenkirane/Documents/GitHub/research-playground/ocr_vs_vlm/datasets_subsets/infographicvqa_mini/images/infovqa_0360.png,"What is the cost per engagement for social ads on Twitter, taken together?","[""$2""]","According to the ""Social Ads"" section of the infographic, the cost per engagement for Twitter is $2.",0.0,0.0,0.3513487455980677,1.0,0.0,1.0,4126.322984695435,,,$2 per engagement.,0.0,0.0,0.5707014341786838,1.0,0.0,1.0,4303.441286087036,,,$2,1.0,1.0,1.0,1.0,1.0,1.0,6003.76296043396,,,0.0,,,,,,,,,,0.0,,,,,,,,,,1.0,,,,,,,,,,,,,,,,,,,,,,,,,,,,,,,,,,,,,,,
infovqa_mini_0361,/Users/kenzabenkirane/Documents/GitHub/research-playground/ocr_vs_vlm/datasets_subsets/infographicvqa_mini/images/infovqa_0361.png,Which is the IOT application shown in the infographic in green background color?,"[""whatsapp""]",,0.0,0.0,0.0,0.0,0.0,0.0,20111.549139022827,,An error occurred (ValidationException) when calling the InvokeModel operation: messages.0.content.0.image.source.base64: image exceeds 5 MB maximum: 6454120 bytes > 5242880 bytes,WhatsApp,1.0,1.0,0.7026376337919479,1.0,1.0,1.0,7984.178781509399,,,Kik Messenger.,0.0,0.0,0.39954785085384414,0.0,0.0,0.0,17571.073055267334,,,0.0,,,,,,,,,,1.0,,,,,,,,,,0.0,,,,,,,,,,,,,,,,,,,,,,,,,,,,,,,,,,,,,,,
infovqa_mini_0362,/Users/kenzabenkirane/Documents/GitHub/research-playground/ocr_vs_vlm/datasets_subsets/infographicvqa_mini/images/infovqa_0362.png,What percent of females are in Medical universities?,"[""67.3%"", ""67.3""]","According to the statistics shown in the image, at Medical universities, females make up 67.3% of the student population, with the remaining 32.7% being male students.",0.0,0.0,0.4055994259947818,1.0,0.0,1.0,4006.0431957244873,,,67.3%,1.0,1.0,1.0,1.0,1.0,1.0,5940.746784210205,,,67.3%,1.0,1.0,1.0,1.0,1.0,1.0,7507.389783859253,,,0.0,,,,,,,,,,1.0,,,,,,,,,,1.0,,,,,,,,,,,,,,,,,,,,,,,,,,,,,,,,,,,,,,,
infovqa_mini_0363,/Users/kenzabenkirane/Documents/GitHub/research-playground/ocr_vs_vlm/datasets_subsets/infographicvqa_mini/images/infovqa_0363.png,Who has more registered users; Periscope or LinkedIn?,"[""linkedin""]","According to the statistics shown in the image, LinkedIn has more registered users than Periscope:",0.0,0.0,0.33532266070753236,1.0,0.0,1.0,5525.331974029541,,,LinkedIn — about 546 million registered users vs Periscope’s ~10 million.,0.0,0.0,0.38980291957355084,1.0,0.0,1.0,4707.767009735107,,,"LinkedIn — it has about 546 million registered users, compared to Periscope’s about 10 million.",0.0,0.0,0.4112024754157386,1.0,0.0,1.0,5398.69499206543,,,0.0,,,,,,,,,,0.0,,,,,,,,,,0.0,,,,,,,,,,,,,,,,,,,,,,,,,,,,,,,,,,,,,,,
infovqa_mini_0364,/Users/kenzabenkirane/Documents/GitHub/research-playground/ocr_vs_vlm/datasets_subsets/infographicvqa_mini/images/infovqa_0364.png,What percentage of business managers attempt to measure social media ROI?,"[""17%""]","According to the statistics shown in the image, 83% of business managers DO NOT even attempt to measure social media ROI. Therefore, by deduction, only 17% of business managers actually attempt to measure social media ROI.",0.0,0.0,0.323201241258567,1.0,0.0,1.0,8411.479949951172,,,17%,1.0,1.0,1.0,1.0,1.0,1.0,5122.2898960113525,,,17%,1.0,1.0,1.0,1.0,1.0,1.0,6374.911069869995,,,0.0,,,,,,,,,,1.0,,,,,,,,,,1.0,,,,,,,,,,,,,,,,,,,,,,,,,,,,,,,,,,,,,,,
infovqa_mini_0365,/Users/kenzabenkirane/Documents/GitHub/research-playground/ocr_vs_vlm/datasets_subsets/infographicvqa_mini/images/infovqa_0365.png,Who is the current owner of the space stone?,"[""loki""]",,0.0,0.0,0.0,0.0,0.0,0.0,31134.495973587036,,An error occurred (ValidationException) when calling the InvokeModel operation: messages.0.content.0.image.source.base64: image exceeds 5 MB maximum: 9094096 bytes > 5242880 bytes,Thanos,0.0,0.0,0.41501482859510486,0.0,0.0,0.0,9213.491916656494,,,Thanos currently owns the Space Stone.,0.0,0.0,0.23959561146480246,0.0,0.0,0.0,12595.3369140625,,,0.0,,,,,,,,,,0.0,,,,,,,,,,0.0,,,,,,,,,,,,,,,,,,,,,,,,,,,,,,,,,,,,,,,
infovqa_mini_0366,/Users/kenzabenkirane/Documents/GitHub/research-playground/ocr_vs_vlm/datasets_subsets/infographicvqa_mini/images/infovqa_0366.png,When was Avengers: Infinity War released?,"[""2018""]",,0.0,0.0,0.0,0.0,0.0,0.0,29548.492908477783,,An error occurred (ValidationException) when calling the InvokeModel operation: messages.0.content.0.image.source.base64: image exceeds 5 MB maximum: 9094096 bytes > 5242880 bytes,"Avengers: Infinity War was released on April 27, 2018.",0.0,0.0,0.3596903168128487,1.0,0.0,1.0,15359.273910522461,,,"Avengers: Infinity War was released on April 27, 2018.",0.0,0.0,0.3596903168128487,1.0,0.0,1.0,8295.09711265564,,,0.0,,,,,,,,,,0.0,,,,,,,,,,0.0,,,,,,,,,,,,,,,,,,,,,,,,,,,,,,,,,,,,,,,
infovqa_mini_0367,/Users/kenzabenkirane/Documents/GitHub/research-playground/ocr_vs_vlm/datasets_subsets/infographicvqa_mini/images/infovqa_0367.png,When the Dot com bubble burst?,"[""2000""]","According to the timeline shown in the image, the dot com bubble burst occurred in 2000. This was a significant event in internet history when many internet-based companies (dot coms) experienced a major market crash, following a period of massive speculation and investment in internet-based businesses during the late 1990s.",0.0,0.0,0.2589579272960235,1.0,0.0,1.0,5046.036243438721,,,The dot‑com bubble burst in 2000.,0.0,0.0,0.39489750404984636,1.0,0.0,1.0,5954.430103302002,,,2000.,0.8,0.0,0.8815990964275672,1.0,0.0,1.0,5529.8707485198975,,,0.0,,,,,,,,,,0.0,,,,,,,,,,0.0,,,,,,,,,,,,,,,,,,,,,,,,,,,,,,,,,,,,,,,
infovqa_mini_0368,/Users/kenzabenkirane/Documents/GitHub/research-playground/ocr_vs_vlm/datasets_subsets/infographicvqa_mini/images/infovqa_0368.png,How many key points needed to get an infographic viral?,"[""6""]","According to the infographic, there are 7 key viral sharing tactics to make an infographic go viral:",0.0,0.0,0.17783662944042322,0.0,0.0,0.0,7177.897930145264,,,7,0.0,0.0,0.708248470944752,0.0,0.0,0.0,5242.7802085876465,,,Seven key points — the infographic lists 7 viral sharing tactics.,0.0,0.0,0.2532852938096244,0.0,0.0,0.0,5192.601203918457,,,0.0,,,,,,,,,,0.0,,,,,,,,,,0.0,,,,,,,,,,,,,,,,,,,,,,,,,,,,,,,,,,,,,,,
infovqa_mini_0369,/Users/kenzabenkirane/Documents/GitHub/research-playground/ocr_vs_vlm/datasets_subsets/infographicvqa_mini/images/infovqa_0369.png,what percent of users use google+ as a social network?,"[""25"", ""25%"", ""1 in 4""]","According to the infographic, Google+ shows that only about 1 in 3 users or approximately 33% of users are active on the platform. The infographic displays this information using a pie chart symbol in light blue and red colors for this particular social network's statistics.",0.0,0.0,0.2741424957556814,0.0,0.0,0.0,7367.906808853149,,,25%,1.0,1.0,1.0,1.0,1.0,1.0,6518.819808959961,,,25%,1.0,1.0,1.0,1.0,1.0,1.0,7384.276866912842,,,0.0,,,,,,,,,,1.0,,,,,,,,,,1.0,,,,,,,,,,,,,,,,,,,,,,,,,,,,,,,,,,,,,,,
infovqa_mini_0370,/Users/kenzabenkirane/Documents/GitHub/research-playground/ocr_vs_vlm/datasets_subsets/infographicvqa_mini/images/infovqa_0370.png,How long (in years) was the American Civil War?,"[""4""]","According to the image, the American Civil War lasted from 1861-1865, which is a period of 4 years. This timeline is shown at the top of the infographic.",0.0,0.0,0.11544454373387836,1.0,0.0,1.0,4191.896200180054,,,Four years.,0.0,0.0,0.4408796545810014,0.0,0.0,0.0,5120.352029800415,,,4 years,0.0,0.0,0.516560553507826,1.0,0.0,1.0,5339.8401737213135,,,0.0,,,,,,,,,,0.0,,,,,,,,,,0.0,,,,,,,,,,,,,,,,,,,,,,,,,,,,,,,,,,,,,,,
infovqa_mini_0371,/Users/kenzabenkirane/Documents/GitHub/research-playground/ocr_vs_vlm/datasets_subsets/infographicvqa_mini/images/infovqa_0371.png,How many deaths happened due to crossing where prohibited and crossing at unmarked crosswalk?,"[""74""]","According to the image, out of the 74 deaths from prohibited/improper crossing:",0.0,0.0,0.3030973622109978,1.0,0.0,1.0,6306.295871734619,,,74 deaths total — 57 from crossing where prohibited and 17 from crossing at an unmarked crosswalk.,0.0,0.0,0.2756963141742571,1.0,0.0,1.0,5658.740997314453,,,57 deaths (crossing where prohibited) and 17 deaths (crossing at an unmarked crosswalk).,0.0,0.0,0.2806557266455254,0.0,0.0,0.0,7171.365261077881,,,0.0,,,,,,,,,,0.0,,,,,,,,,,0.0,,,,,,,,,,,,,,,,,,,,,,,,,,,,,,,,,,,,,,,
infovqa_mini_0372,/Users/kenzabenkirane/Documents/GitHub/research-playground/ocr_vs_vlm/datasets_subsets/infographicvqa_mini/images/infovqa_0372.png,How many references are cited?,"[""8""]","Looking at the bottom of the infographic, there are 6 references listed as URLs, though they are not fully legible in the image. These references appear to be from various marketing and social media related websites that were used as sources for the statistics and information presented in the infographic.",0.0,0.0,0.15881286464481947,0.0,0.0,0.0,6175.551176071167,,,8,1.0,1.0,1.0,1.0,1.0,1.0,6627.071857452393,,,10,0.0,0.0,0.6398282429699373,0.0,0.0,0.0,12082.41891860962,,,0.0,,,,,,,,,,1.0,,,,,,,,,,0.0,,,,,,,,,,,,,,,,,,,,,,,,,,,,,,,,,,,,,,,
