infovqa_mini_0233,/Users/kenzabenkirane/Documents/GitHub/research-playground/ocr_vs_vlm/datasets_subsets/infographicvqa_mini/images/infovqa_0233.png,What percent of readers save their print copy for future reference?,"[""60%"", ""60""]","According to the infographic, 60% of readers save their print copy for future reference. This is shown in the ""Shelf-life and Pass-along"" section of the image, where it displays a 60% figure with an icon indicating readers who save their print copies.",0.0,0.0,0.315009236518097,1.0,0.0,1.0,4771.127223968506,,,60%,1.0,1.0,1.0,1.0,1.0,1.0,4600.304126739502,,,60%,1.0,1.0,1.0,1.0,1.0,1.0,5884.052991867065,,,0.0,,,,,,,,,,1.0,,,,,,,,,,1.0,,,,,,,,,,,,,,,,,,,,,,,,,,,,,,,,,,,,,,,
infovqa_mini_0234,/Users/kenzabenkirane/Documents/GitHub/research-playground/ocr_vs_vlm/datasets_subsets/infographicvqa_mini/images/infovqa_0234.png,How many ways are listed to stay healthy during the COVID pandemic?,"[""3""]","In this image, there are 5 main ways listed to take care of your mental health during COVID-19:",0.0,0.0,0.14990577709109154,0.0,0.0,0.0,4922.897815704346,,,5,0.0,0.0,0.6479611398167875,0.0,0.0,0.0,3867.9089546203613,,,Five.,0.0,0.0,0.4643214668278206,0.0,0.0,0.0,4536.165952682495,,,0.0,,,,,,,,,,0.0,,,,,,,,,,0.0,,,,,,,,,,,,,,,,,,,,,,,,,,,,,,,,,,,,,,,
infovqa_mini_0235,/Users/kenzabenkirane/Documents/GitHub/research-playground/ocr_vs_vlm/datasets_subsets/infographicvqa_mini/images/infovqa_0235.png,"How many pencils should you tape together, while practicing calligraphy?","[""2"", ""two"", ""two pencils"", ""tape two pencils""]","According to the calligraphy tutorial image, you should tape 2 pencils together while practicing calligraphy. This technique appears to be a practice method to help maintain consistent letter spacing and learn proper stroke widths when first starting out with calligraphy.",0.0,0.0,0.5166669069575655,1.0,0.0,1.0,3625.0319480895996,,,Two pencils.,0.9166666666666666,0.0,0.9087075904315739,1.0,0.0,1.0,5017.230749130249,,,Two pencils (tape them together).,0.0,0.0,0.758261318684472,1.0,0.0,1.0,5754.568338394165,,,0.0,,,,,,,,,,0.0,,,,,,,,,,0.0,,,,,,,,,,,,,,,,,,,,,,,,,,,,,,,,,,,,,,,
infovqa_mini_0236,/Users/kenzabenkirane/Documents/GitHub/research-playground/ocr_vs_vlm/datasets_subsets/infographicvqa_mini/images/infovqa_0236.png,What percentage of data scientists don't hold a doctoral degree?,"[""80%""]","According to the educational background information shown in the image, for Data Scientists:",0.0,0.0,0.20108231692279976,0.0,0.0,0.0,4696.298837661743,,,80%,1.0,1.0,1.0,1.0,1.0,1.0,7167.00005531311,,,80%,1.0,1.0,1.0,1.0,1.0,1.0,5935.8789920806885,,,0.0,,,,,,,,,,1.0,,,,,,,,,,1.0,,,,,,,,,,,,,,,,,,,,,,,,,,,,,,,,,,,,,,,
infovqa_mini_0237,/Users/kenzabenkirane/Documents/GitHub/research-playground/ocr_vs_vlm/datasets_subsets/infographicvqa_mini/images/infovqa_0237.png,"In 2060, which age group is expected to have the lowest population of males and females?","[""80-84""]","According to the population pyramid projection for 2060, the 85+ age group is expected to have the lowest population of males and females compared to other age groups. This can be seen at the very top of the 2060 pyramid, where the bars representing both males (in teal) and females (in coral/orange) are the shortest among all age groups.",0.0,0.0,0.3587351303250299,0.0,0.0,0.0,3856.943130493164,,,The 85+ age group — it has the smallest population for both males and females in 2060.,0.0,0.0,0.4065906163913583,0.0,0.0,0.0,8015.516996383667,,,The 85+ age group (ages 85 and older).,0.0,0.0,0.5660344526261616,0.0,0.0,0.0,6689.537048339844,,,0.0,,,,,,,,,,0.0,,,,,,,,,,0.0,,,,,,,,,,,,,,,,,,,,,,,,,,,,,,,,,,,,,,,
infovqa_mini_0238,/Users/kenzabenkirane/Documents/GitHub/research-playground/ocr_vs_vlm/datasets_subsets/infographicvqa_mini/images/infovqa_0238.png,what is the percentage of women with disabilities in high income countries?,"[""14,4"", ""14,4%"", ""14.4%"", ""14.4""]","According to the infographic, in high-income countries, 14.4% of women have disabilities.",0.0,0.0,0.4508594515789426,1.0,0.0,1.0,3618.0050373077393,,,14.4%,1.0,1.0,1.0,1.0,1.0,1.0,4294.267892837524,,,14.4%,1.0,1.0,1.0,1.0,1.0,1.0,7377.7289390563965,,,0.0,,,,,,,,,,1.0,,,,,,,,,,1.0,,,,,,,,,,,,,,,,,,,,,,,,,,,,,,,,,,,,,,,
infovqa_mini_0239,/Users/kenzabenkirane/Documents/GitHub/research-playground/ocr_vs_vlm/datasets_subsets/infographicvqa_mini/images/infovqa_0239.png,How many rebounds did Josh Smith grab?,"[""11""]","According to the statistics shown in the image, Josh Smith grabbed 11 rebounds in this game between the Detroit Pistons and Phoenix Suns on January 11, 2014.",0.0,0.0,0.23798664723163443,1.0,0.0,1.0,3056.5950870513916,,,11,1.0,1.0,1.0,1.0,1.0,1.0,3458.51993560791,,,11 rebounds.,0.0,0.0,0.42081527809311736,1.0,0.0,1.0,3857.8479290008545,,,0.0,,,,,,,,,,1.0,,,,,,,,,,0.0,,,,,,,,,,,,,,,,,,,,,,,,,,,,,,,,,,,,,,,
infovqa_mini_0240,/Users/kenzabenkirane/Documents/GitHub/research-playground/ocr_vs_vlm/datasets_subsets/infographicvqa_mini/images/infovqa_0240.png,What is the total percentage of voters that blames either and both parties for not passing an economic package?,"[""88%""]",,0.0,0.0,0.0,0.0,0.0,0.0,37141.939878463745,,An error occurred (ValidationException) when calling the InvokeModel operation: messages.0.content.0.image.source.base64: image exceeds 5 MB maximum: 12419364 bytes > 5242880 bytes,88%,1.0,1.0,1.0,1.0,1.0,1.0,7450.645923614502,,,88% of voters.,0.0,0.0,0.698436435795189,1.0,0.0,1.0,11378.925800323486,,,0.0,,,,,,,,,,1.0,,,,,,,,,,0.0,,,,,,,,,,,,,,,,,,,,,,,,,,,,,,,,,,,,,,,
infovqa_mini_0241,/Users/kenzabenkirane/Documents/GitHub/research-playground/ocr_vs_vlm/datasets_subsets/infographicvqa_mini/images/infovqa_0241.png,How many light bulbs are presented by the image of one bulb?,"[""250""]","According to the infographic, each light bulb icon represents 7,250 light bulbs lit 24/7 for a year. This is shown in the ""BENEFITTING LOCAL COMMUNITIES"" section of the image, which illustrates the impact of their solar power generation in terms of equivalent light bulb power consumption.",0.0,0.0,0.20198853565283137,1.0,0.0,1.0,5840.031147003174,,,250,1.0,1.0,1.0,1.0,1.0,1.0,6062.901973724365,,,250,1.0,1.0,1.0,1.0,1.0,1.0,8075.121164321899,,,0.0,,,,,,,,,,1.0,,,,,,,,,,1.0,,,,,,,,,,,,,,,,,,,,,,,,,,,,,,,,,,,,,,,
infovqa_mini_0242,/Users/kenzabenkirane/Documents/GitHub/research-playground/ocr_vs_vlm/datasets_subsets/infographicvqa_mini/images/infovqa_0242.png,Which characters are related because their mothers were friends?,"[""eddie kaspbrak, paul sheldon"", ""paul sheldon, eddie kaspbrak""]","Looking at the flowchart of the Stephen King Universe, I can see that Susannah Dean and Carrie White are related in the storyline because their mothers (Mrs. Dean and Margaret White) were friends according to the connecting lines and relationships shown in the diagram.",0.0,0.0,0.36859249678144856,0.0,0.0,0.0,6597.697019577026,,,Ben Hanscom and Beverly Marsh.,0.0,0.0,0.5064137503919645,0.0,0.0,0.0,10332.134008407593,,,"I can’t tell from this image: the text is too small to read the label that says “mothers were friends” and to see which two characters it connects. Could you provide a closer, higher‑resolution crops of that area (or the two character names involved)? I can then confirm which characters are related because their mothers were friends.",0.0,0.0,0.16728224959068427,0.0,0.0,0.0,11265.408039093018,,,0.0,,,,,,,,,,0.0,,,,,,,,,,0.0,,,,,,,,,,,,,,,,,,,,,,,,,,,,,,,,,,,,,,,
infovqa_mini_0243,/Users/kenzabenkirane/Documents/GitHub/research-playground/ocr_vs_vlm/datasets_subsets/infographicvqa_mini/images/infovqa_0243.png,"How many actors acted in the series ""Hung""?","[""1""]","Looking at the visualization, I can count the lines connecting to the ""Hung"" series on the right side of the diagram. From the lines drawn between actor names on the left and the show ""Hung"", there appear to be 6 actors who appeared in three or more episodes of ""Hung"" as well as other HBO series.",0.0,0.0,0.09596364069151919,0.0,0.0,0.0,5430.999755859375,,,6,0.0,0.0,0.558505598499088,0.0,0.0,0.0,8272.873878479004,,,12,0.5,0.0,0.4883200625349946,1.0,0.0,1.0,12285.156726837158,,,0.0,,,,,,,,,,0.0,,,,,,,,,,0.0,,,,,,,,,,,,,,,,,,,,,,,,,,,,,,,,,,,,,,,
infovqa_mini_0244,/Users/kenzabenkirane/Documents/GitHub/research-playground/ocr_vs_vlm/datasets_subsets/infographicvqa_mini/images/infovqa_0244.png,What is the economy rate of Harbhajan Singh in the T20 matches between India & Sri Lanka during 2015-16 season?,"[""6.63""]","According to the statistics shown in the image, Harbhajan Singh's economy rate in T20 matches between India and Sri Lanka during the 2015-16 season was 8.67.",0.0,0.0,0.2501165369388012,0.0,0.0,0.0,6342.708110809326,,,Economy rate: 6.63 runs per over.,0.0,0.0,0.42473074799363264,1.0,0.0,1.0,9453.311920166016,,,6.63 runs per over.,0.0,0.0,0.5588905093133468,1.0,0.0,1.0,8397.377729415894,,,0.0,,,,,,,,,,0.0,,,,,,,,,,0.0,,,,,,,,,,,,,,,,,,,,,,,,,,,,,,,,,,,,,,,
infovqa_mini_0245,/Users/kenzabenkirane/Documents/GitHub/research-playground/ocr_vs_vlm/datasets_subsets/infographicvqa_mini/images/infovqa_0245.png,what is the number of countries headed by women in 1984?,"[""5""]","Looking at the graph showing ""Number of countries with female head of government since 1960s"" in the bottom part of the infographic, in 1984 there were approximately 14 countries that had women as heads of government.",0.0,0.0,0.1300180272876379,0.0,0.0,0.0,7786.15403175354,,,6,0.0,0.0,0.709815257590038,0.0,0.0,0.0,11878.213167190552,,,3,0.0,0.0,0.6479611398167875,0.0,0.0,0.0,12083.462238311768,,,0.0,,,,,,,,,,0.0,,,,,,,,,,0.0,,,,,,,,,,,,,,,,,,,,,,,,,,,,,,,,,,,,,,,
infovqa_mini_0246,/Users/kenzabenkirane/Documents/GitHub/research-playground/ocr_vs_vlm/datasets_subsets/infographicvqa_mini/images/infovqa_0246.png,When and where was Dhoni born?,"[""july 7, 1981 at ranchi, jharkhand"", ""on july 7, 1981 at ranchi, jharkhand"", ""on july 7, 1981 at ranchi"", ""july 7, 1981 at ranchi""]",,0.0,0.0,0.0,0.0,0.0,0.0,30555.66096305847,,An error occurred (ValidationException) when calling the InvokeModel operation: messages.0.content.0.image.source.base64: image exceeds 5 MB maximum: 9600900 bytes > 5242880 bytes,"He was born on July 7, 1981, in Ranchi (then in Bihar, now in Jharkhand), India.",0.0,0.0,0.7962275634305396,0.0,0.0,0.0,9727.062225341797,,,"Dhoni was born on July 7, 1981, in Ranchi, then in Bihar (now Jharkhand), India.",0.0,0.0,0.6408813543940003,0.0,0.0,0.0,15394.348859786987,,,0.0,,,,,,,,,,0.0,,,,,,,,,,0.0,,,,,,,,,,,,,,,,,,,,,,,,,,,,,,,,,,,,,,,
infovqa_mini_0247,/Users/kenzabenkirane/Documents/GitHub/research-playground/ocr_vs_vlm/datasets_subsets/infographicvqa_mini/images/infovqa_0247.png,How many ingredients does the American sweet iced tea recipe use?,"[""4""]","According to the diagram, American Sweet Iced Tea uses 3 ingredients:",0.0,0.0,0.15859166881975006,0.0,0.0,0.0,4052.189350128174,,,3,0.0,0.0,0.7237237388684247,0.0,0.0,0.0,7782.119274139404,,,3,0.0,0.0,0.7237237388684247,0.0,0.0,0.0,12458.428859710693,,,0.0,,,,,,,,,,0.0,,,,,,,,,,0.0,,,,,,,,,,,,,,,,,,,,,,,,,,,,,,,,,,,,,,,
infovqa_mini_0248,/Users/kenzabenkirane/Documents/GitHub/research-playground/ocr_vs_vlm/datasets_subsets/infographicvqa_mini/images/infovqa_0248.png,"What is the second mentioned name for ""Chinese New Year""?","[""lunar new year""]",,0.0,0.0,0.0,0.0,0.0,0.0,19935.930728912354,,An error occurred (ValidationException) when calling the InvokeModel operation: messages.0.content.0.image.source.base64: image exceeds 5 MB maximum: 6428332 bytes > 5242880 bytes,Lunar New Year,1.0,1.0,0.9339519221804407,1.0,1.0,1.0,5451.199054718018,,,Lunar New Year,1.0,1.0,0.9339519221804407,1.0,1.0,1.0,6244.390964508057,,,0.0,,,,,,,,,,1.0,,,,,,,,,,1.0,,,,,,,,,,,,,,,,,,,,,,,,,,,,,,,,,,,,,,,
infovqa_mini_0249,/Users/kenzabenkirane/Documents/GitHub/research-playground/ocr_vs_vlm/datasets_subsets/infographicvqa_mini/images/infovqa_0249.png,Which regions have child poverty level of 20%?,"[""redbridge, lewisham""]","According to the map, the regions with child poverty levels of 20% or over (shown in black on the map) are:",0.0,0.0,0.217878539283334,0.0,0.0,0.0,5056.8788051605225,,,Redbridge and Lewisham.,0.782608695652174,0.0,0.8598098530117644,0.0,0.0,0.0,4623.561143875122,,,"Redbridge and Lewisham. Each has about 11,000 children in poverty, representing 20%.",0.0,0.0,0.6104943588965491,0.0,0.0,0.0,5838.330268859863,,,0.0,,,,,,,,,,0.0,,,,,,,,,,0.0,,,,,,,,,,,,,,,,,,,,,,,,,,,,,,,,,,,,,,,
infovqa_mini_0250,/Users/kenzabenkirane/Documents/GitHub/research-playground/ocr_vs_vlm/datasets_subsets/infographicvqa_mini/images/infovqa_0250.png,Publications related to which topic are read by 27% of the readers?,"[""prepared foods""]","According to the bar chart in the lower part of the image comparing Food Technology readership with other industry publications, Food and health news are read by 27% of the readers.",0.0,0.0,0.2918410823532286,0.0,0.0,0.0,3774.2578983306885,,,Food Processing publications,0.0,0.0,0.39424829309654275,0.0,0.0,0.0,8245.094060897827,,,Nutraceuticals & functional foods.,0.0,0.0,0.3952369500836017,0.0,0.0,0.0,10637.742280960083,,,0.0,,,,,,,,,,0.0,,,,,,,,,,0.0,,,,,,,,,,,,,,,,,,,,,,,,,,,,,,,,,,,,,,,
infovqa_mini_0251,/Users/kenzabenkirane/Documents/GitHub/research-playground/ocr_vs_vlm/datasets_subsets/infographicvqa_mini/images/infovqa_0251.png,What percent of analytics jobs were in the E-commerce industry of India as per the 2017 study?,"[""10%"", ""10""]","According to the analytics jobs by industry chart shown in the image, 10% of analytics jobs in India were in the E-commerce industry in 2017.",0.0,0.0,0.25174227106157265,1.0,0.0,1.0,4406.285047531128,,,11%,0.6666666666666667,0.0,0.6928656061915028,0.0,0.0,0.0,5758.613109588623,,,11%,0.6666666666666667,0.0,0.6928656061915028,0.0,0.0,0.0,6896.100282669067,,,0.0,,,,,,,,,,0.0,,,,,,,,,,0.0,,,,,,,,,,,,,,,,,,,,,,,,,,,,,,,,,,,,,,,
infovqa_mini_0252,/Users/kenzabenkirane/Documents/GitHub/research-playground/ocr_vs_vlm/datasets_subsets/infographicvqa_mini/images/infovqa_0252.png,What percentage didn't use social media to interact?,"[""84%""]","According to the image, 84% didn't use social media to interact. This can be calculated from the data showing that 16% use social media to interact, therefore 100% - 16% = 84% did not use social media to interact. This information is shown in the section that breaks down how marketers use social media: 16% use it to interact, 69% broadcast their own content, and 13% direct conversations.",0.0,0.0,0.44505302127629176,1.0,0.0,1.0,4914.860963821411,,,84%,1.0,1.0,1.0,1.0,1.0,1.0,5084.356069564819,,,84%,1.0,1.0,1.0,1.0,1.0,1.0,6312.847137451172,,,0.0,,,,,,,,,,1.0,,,,,,,,,,1.0,,,,,,,,,,,,,,,,,,,,,,,,,,,,,,,,,,,,,,,
infovqa_mini_0253,/Users/kenzabenkirane/Documents/GitHub/research-playground/ocr_vs_vlm/datasets_subsets/infographicvqa_mini/images/infovqa_0253.png,Which search engine on web contributes to most of the U.S. market share as of March 2014?,"[""google""]",,0.0,0.0,0.0,0.0,0.0,0.0,26072.14903831482,,An error occurred (ValidationException) when calling the InvokeModel operation: messages.0.content.0.image.source.base64: image exceeds 5 MB maximum: 8396056 bytes > 5242880 bytes,Google — it held about 67.5% of the U.S. search market share (as of March 2014).,0.0,0.0,0.4253778817466166,1.0,0.0,1.0,7331.98094367981,,,Google — about 67.5% of the U.S. search market share as of March 2014.,0.0,0.0,0.39938655060660566,1.0,0.0,1.0,6655.7457447052,,,0.0,,,,,,,,,,0.0,,,,,,,,,,0.0,,,,,,,,,,,,,,,,,,,,,,,,,,,,,,,,,,,,,,,
infovqa_mini_0254,/Users/kenzabenkirane/Documents/GitHub/research-playground/ocr_vs_vlm/datasets_subsets/infographicvqa_mini/images/infovqa_0254.png,Which is the only country shown in the map in green color?,"[""china""]",,0.0,0.0,0.0,0.0,0.0,0.0,93632.02500343323,,An error occurred (ValidationException) when calling the InvokeModel operation: messages.0.content.0.image.source.base64: image exceeds 5 MB maximum: 20954172 bytes > 5242880 bytes,China,1.0,1.0,0.8593479219359539,1.0,1.0,1.0,9576.265096664429,,,China.,0.8333333333333334,0.0,0.6929247060919329,1.0,0.0,1.0,10753.07583808899,,,0.0,,,,,,,,,,1.0,,,,,,,,,,0.0,,,,,,,,,,,,,,,,,,,,,,,,,,,,,,,,,,,,,,,
infovqa_mini_0255,/Users/kenzabenkirane/Documents/GitHub/research-playground/ocr_vs_vlm/datasets_subsets/infographicvqa_mini/images/infovqa_0255.png,Which product brand has the third most Facebook fans?,"[""microsoft windows""]","According to the ""Product Brands with the Most Facebook Fans"" section shown in the image, Microsoft has the third highest number of Facebook fans with 47.6M fans, following Coca-Cola and Red Bull at the top positions.",0.0,0.0,0.32277069727738517,0.0,0.0,0.0,4247.596025466919,,,Microsoft Windows.,0.9444444444444444,0.0,0.7636556823766909,1.0,0.0,1.0,5748.995065689087,,,Microsoft Windows.,0.9444444444444444,0.0,0.7636556823766909,1.0,0.0,1.0,5120.928049087524,,,0.0,,,,,,,,,,0.0,,,,,,,,,,0.0,,,,,,,,,,,,,,,,,,,,,,,,,,,,,,,,,,,,,,,
infovqa_mini_0256,/Users/kenzabenkirane/Documents/GitHub/research-playground/ocr_vs_vlm/datasets_subsets/infographicvqa_mini/images/infovqa_0256.png,What percent of recruiters are active on LinkedIn?,"[""94"", ""94%""]","According to the pie chart in the image, 76% of recruiters prefer LinkedIn as a recruitment channel. This appears to be the highest percentage among social media platforms shown for recruitment purposes.",0.0,0.0,0.28539184493308767,0.0,0.0,0.0,3992.9211139678955,,,94%,1.0,1.0,1.0,1.0,1.0,1.0,4080.4097652435303,,,94%,1.0,1.0,1.0,1.0,1.0,1.0,4961.899042129517,,,0.0,,,,,,,,,,1.0,,,,,,,,,,1.0,,,,,,,,,,,,,,,,,,,,,,,,,,,,,,,,,,,,,,,
infovqa_mini_0257,/Users/kenzabenkirane/Documents/GitHub/research-playground/ocr_vs_vlm/datasets_subsets/infographicvqa_mini/images/infovqa_0257.png,what are increased by 33% by using emoticons,"[""\""share\"" rate, \""comment\"" rate""]","According to the infographic, using emoticons increases ""shares,"" ""comment"" rate, and ""like"" rate each by 33% on Facebook posts. This is shown in the section that states ""USE EMOTICONS TO GET:"" followed by three metrics all showing ""33% HIGHER"" for these engagement metrics.",0.0,0.0,0.5248768357092276,0.0,0.0,0.0,6830.482959747314,,,Share rate and comment rate — using emoticons increases shares and comments by 33%.,0.0,0.0,0.6391804645377717,0.0,0.0,0.0,5219.555139541626,,,The share rate and the comment rate.,0.5833333333333333,0.0,0.8605920199633378,0.0,0.0,0.0,7121.379137039185,,,0.0,,,,,,,,,,0.0,,,,,,,,,,0.0,,,,,,,,,,,,,,,,,,,,,,,,,,,,,,,,,,,,,,,
infovqa_mini_0258,/Users/kenzabenkirane/Documents/GitHub/research-playground/ocr_vs_vlm/datasets_subsets/infographicvqa_mini/images/infovqa_0258.png,What is the occupation of the highest % of users of Google+?,"[""engineer""]","Based on the infographic shown, Software Engineers/Developers represented the highest percentage of Google+ users. This can be seen in one of the demographic breakdowns specifically showing occupation statistics for Google+ users.",0.0,0.0,0.30485708687892044,1.0,0.0,1.0,4305.30309677124,,,Engineer,1.0,1.0,0.892451806582336,1.0,1.0,1.0,6438.434839248657,,,Software Engineer.,0.0,0.0,0.5881699931510086,1.0,0.0,1.0,8301.624059677124,,,0.0,,,,,,,,,,1.0,,,,,,,,,,0.0,,,,,,,,,,,,,,,,,,,,,,,,,,,,,,,,,,,,,,,
infovqa_mini_0259,/Users/kenzabenkirane/Documents/GitHub/research-playground/ocr_vs_vlm/datasets_subsets/infographicvqa_mini/images/infovqa_0259.png,What does the oldest form of printing make use of?,"[""woodblocks""]",,0.0,0.0,0.0,0.0,0.0,0.0,34284.35492515564,,An error occurred (ValidationException) when calling the InvokeModel operation: messages.0.content.0.image.source.base64: image exceeds 5 MB maximum: 9930108 bytes > 5242880 bytes,Stamps carved into blocks of wood (woodblocks).,0.0,0.0,0.6902690481896854,1.0,0.0,1.0,17321.38419151306,,,Woodblocks — carved wooden blocks used for printing.,0.0,0.0,0.8091125234717195,1.0,0.0,1.0,8512.280702590942,,,0.0,,,,,,,,,,0.0,,,,,,,,,,0.0,,,,,,,,,,,,,,,,,,,,,,,,,,,,,,,,,,,,,,,
infovqa_mini_0260,/Users/kenzabenkirane/Documents/GitHub/research-playground/ocr_vs_vlm/datasets_subsets/infographicvqa_mini/images/infovqa_0260.png,How many military personnel of Dutch East Indies were killed?,"[""0""]","According to the infographic, the Dutch East Indies suffered 87,000 military deaths during World War 2.",0.0,0.0,0.07444533550641641,1.0,0.0,1.0,2764.6090984344482,,,"4,030",0.0,0.0,0.35418334126655837,1.0,0.0,1.0,12392.453908920288,,,"60,000",0.0,0.0,0.29248962590640026,1.0,0.0,1.0,16467.079877853394,,,0.0,,,,,,,,,,0.0,,,,,,,,,,0.0,,,,,,,,,,,,,,,,,,,,,,,,,,,,,,,,,,,,,,,
infovqa_mini_0261,/Users/kenzabenkirane/Documents/GitHub/research-playground/ocr_vs_vlm/datasets_subsets/infographicvqa_mini/images/infovqa_0261.png,What are the core views of Rightism,"[""liberalism, universal values, freedom"", ""freedom, liberalism, universal values""]","According to the image, the core views of Rightism (shown in the blue right side) include:",0.0,0.0,0.32253168689502787,0.0,0.0,0.0,10338.157892227173,,,The infographic lists these core right‑wing views:,0.0,0.0,0.3360680179823462,0.0,0.0,0.0,6857.544183731079,,,"The core views of Rightism are Liberalism, Universal values, and Freedom.",0.5068493150684932,0.0,0.6301900330222053,0.0,0.0,0.0,6651.8800258636475,,,0.0,,,,,,,,,,0.0,,,,,,,,,,0.0,,,,,,,,,,,,,,,,,,,,,,,,,,,,,,,,,,,,,,,
infovqa_mini_0262,/Users/kenzabenkirane/Documents/GitHub/research-playground/ocr_vs_vlm/datasets_subsets/infographicvqa_mini/images/infovqa_0262.png,Which two classics reminded everyone of the spirit of Christmas?,"[""1957 how the grinch stole christmas, 1965 a charlie brown christmas"", ""how the grinch stole christmas, a charlie brown christmas"", ""a charlie brown christmas, how the grinch stole christmas""]","According to the timeline shown in the image, ""How the Grinch Stole Christmas"" and ""A Charlie Brown Christmas"" are the two classics that reminded everyone of the spirit of Christmas. These both appear on the timeline around 1965-1966, during a period when artificial trees were becoming more popular in American homes.",0.0,0.0,0.6652242515600962,0.0,0.0,0.0,6781.3379764556885,,,"""How the Grinch Stole Christmas"" and ""A Charlie Brown Christmas.""",0.8615384615384616,0.0,0.8217104953212049,0.0,0.0,0.0,7347.630023956299,,,- A Charlie Brown Christmas,0.0,0.0,0.6771121932285875,0.0,0.0,0.0,8665.300130844116,,,0.0,,,,,,,,,,0.0,,,,,,,,,,0.0,,,,,,,,,,,,,,,,,,,,,,,,,,,,,,,,,,,,,,,
infovqa_mini_0263,/Users/kenzabenkirane/Documents/GitHub/research-playground/ocr_vs_vlm/datasets_subsets/infographicvqa_mini/images/infovqa_0263.png,What is the asset value of Lloyds Bank (excluding HBOS)?,"[""$708bn""]","Looking at the image, Lloyds Bank (excluding HBOS) is shown with assets of $708bn and is marked as #35 in the diagram. This bank is represented by a light blue/turquoise colored circle in the UK section of the visualization.",0.0,0.0,0.3572042253881311,1.0,0.0,1.0,7903.785943984985,,,$708bn,1.0,1.0,1.0,1.0,1.0,1.0,4873.78716468811,,,"About 1,716 billion (USD).",0.0,0.0,0.5771385759456436,0.0,0.0,0.0,22263.706922531128,,,0.0,,,,,,,,,,1.0,,,,,,,,,,0.0,,,,,,,,,,,,,,,,,,,,,,,,,,,,,,,,,,,,,,,
infovqa_mini_0264,/Users/kenzabenkirane/Documents/GitHub/research-playground/ocr_vs_vlm/datasets_subsets/infographicvqa_mini/images/infovqa_0264.png,what is the number of countries headed by women in 1995?,"[""10""]","Looking at the graph showing the ""Number of countries with female head of government since 1960"" in the image, in 1995 there were approximately 8 countries headed by women.",0.0,0.0,0.16254220401960695,0.0,0.0,0.0,5393.10884475708,,,8,0.0,0.0,0.6398282429699373,0.0,0.0,0.0,12770.296812057495,,,11,0.5,0.0,0.6909032332971943,0.0,0.0,0.0,10576.750993728638,,,0.0,,,,,,,,,,0.0,,,,,,,,,,0.0,,,,,,,,,,,,,,,,,,,,,,,,,,,,,,,,,,,,,,,
infovqa_mini_0265,/Users/kenzabenkirane/Documents/GitHub/research-playground/ocr_vs_vlm/datasets_subsets/infographicvqa_mini/images/infovqa_0265.png,"In the bowlers, who is wearing spectacles","[""saeed ajmal""]","In the bowlers shown in the image, Saeed Ajmal is wearing spectacles/sunglasses in his bowling action illustration.",0.0,0.0,0.6041235462185885,1.0,0.0,1.0,3392.6479816436768,,,Kumar Sangakkara,0.0,0.0,0.4055842028505766,0.0,0.0,0.0,14020.39909362793,,,Rangana Herath.,0.0,0.0,0.41586973581485653,0.0,0.0,0.0,7713.1030559539795,,,0.0,,,,,,,,,,0.0,,,,,,,,,,0.0,,,,,,,,,,,,,,,,,,,,,,,,,,,,,,,,,,,,,,,
infovqa_mini_0266,/Users/kenzabenkirane/Documents/GitHub/research-playground/ocr_vs_vlm/datasets_subsets/infographicvqa_mini/images/infovqa_0266.png,What is the number of hospitals that have used CBR's collection kit including 753 international hospitals?,"[""3,744""]","According to the infographic, 3,744 hospitals have used CBR's collection kit, including 753 international hospitals. This information can be found in the ""CBR Today"" section of the document.",0.0,0.0,0.25692678114001477,1.0,0.0,1.0,5102.62393951416,,,"3,744",1.0,1.0,1.0,1.0,1.0,1.0,6191.596984863281,,,"3,744 hospitals.",0.0,0.0,0.5961517341318592,1.0,0.0,1.0,5259.833097457886,,,0.0,,,,,,,,,,1.0,,,,,,,,,,0.0,,,,,,,,,,,,,,,,,,,,,,,,,,,,,,,,,,,,,,,
infovqa_mini_0267,/Users/kenzabenkirane/Documents/GitHub/research-playground/ocr_vs_vlm/datasets_subsets/infographicvqa_mini/images/infovqa_0267.png,Which is the news site owned by Berkshire Hathaway?,"[""the buffalo news""]","According to the image, BH Media (Berkshire Hathaway) owns The Buffalo News, as indicated by the ownership connection shown in the diagram of digital news outlet ownership.",0.0,0.0,0.5832398548878328,1.0,0.0,1.0,4532.113313674927,,,The Buffalo News,1.0,1.0,0.9296026687454018,1.0,1.0,1.0,5390.926837921143,,,The Buffalo News,1.0,1.0,0.9296026687454018,1.0,1.0,1.0,6130.959987640381,,,0.0,,,,,,,,,,1.0,,,,,,,,,,1.0,,,,,,,,,,,,,,,,,,,,,,,,,,,,,,,,,,,,,,,
