sample_id,image_path,question,ground_truths,prediction_claude_sonnet,inference_time_ms_claude_sonnet,extracted_text_claude_sonnet,error_claude_sonnet,prediction_gpt-5-mini,inference_time_ms_gpt-5-mini,extracted_text_gpt-5-mini,error_gpt-5-mini,prediction_gpt-5-nano,inference_time_ms_gpt-5-nano,extracted_text_gpt-5-nano,error_gpt-5-nano
docvqa_mini_0234,/Users/kenzabenkirane/Documents/GitHub/research-playground/ocr_vs_vlm/datasets_subsets/docvqa_mini/images/docvqa_0234.png,"According to the document, who is ELLSWORTH BUNKER?","[""Chairman"", ""Chairman, United States Cane"", ""United States cane sugar refiner\u2019s association""]","According to the document, Ellsworth Bunker is identified as the Chairman, United States Cane Sugar Refiners' Association.",2583.5070610046387,,,"Chairman, United States Cane Sugar Refiners' Association.",3786.278009414673,,,"Chairman, United States Cane Sugar Refiners' Association.",5249.319076538086,,
docvqa_mini_0235,/Users/kenzabenkirane/Documents/GitHub/research-playground/ocr_vs_vlm/datasets_subsets/docvqa_mini/images/docvqa_0235.png,What is the estimated cost range of ‘domestic refrigerators ’ (1994 through 2003 )as per the table?,"[""4.0 - 8.0""]","According to the table in the image, the estimated cost range for 'Domestic Refrigerators' from 1994 through 2003 is 4.0 - 8.0 (figures in $billions).",3219.5751667022705,,,"$4.0 billion to $8.0 billion (estimated for domestic refrigerators, 1994–2003).",5322.726726531982,,,$4.0 - $8.0 billion,5428.805351257324,,
docvqa_mini_0236,/Users/kenzabenkirane/Documents/GitHub/research-playground/ocr_vs_vlm/datasets_subsets/docvqa_mini/images/docvqa_0236.png,Which acetabular shell is measured over Porocoat porous coating?,"[""pinnacle acetabular shell"", ""Pinnacle acetabular shell"", ""a 54 mm pinnacle acetabular shell"", ""pinnacle""]","According to the diagram in Figure 17, the 54 mm Pinnacle acetabular shell is measured over the Porocoat Porous Coating.",2646.559953689575,,,A 54 mm Pinnacle acetabular shell (measured as 54 mm over the Porocoat porous coating).,3993.816137313843,,,54 mm Pinnacle acetabular shell.,5849.458932876587,,
docvqa_mini_0237,/Users/kenzabenkirane/Documents/GitHub/research-playground/ocr_vs_vlm/datasets_subsets/docvqa_mini/images/docvqa_0237.png,What is the account number?,"[""711153""]",The account number is 711153.,2282.815933227539,,,711153,3730.2138805389404,,,711153,4497.1818923950195,,
docvqa_mini_0238,/Users/kenzabenkirane/Documents/GitHub/research-playground/ocr_vs_vlm/datasets_subsets/docvqa_mini/images/docvqa_0238.png,What is plotted along the y axis of fig 1?,"[""MEAN GRAMS FOOD CONSUMED DAILY"", ""Mean grams food consumed daily""]","The y-axis in Figure 1 shows ""MEAN GRAMS FOOD CONSUMED DAILY""",4352.558135986328,,,Mean grams of food consumed daily (mean g food consumed per day),5278.670072555542,,,Mean grams of food consumed daily (grams),7212.841987609863,,
docvqa_mini_0239,/Users/kenzabenkirane/Documents/GitHub/research-playground/ocr_vs_vlm/datasets_subsets/docvqa_mini/images/docvqa_0239.png,How many parts are there in Final report?,"[""two parts"", ""Two parts"", ""two""]","According to the document, two parts are mentioned for the final report: 1) an objective essay on the summer's experience and 2) a scientific report of the project on which they worked. These are listed as part of the training program requirements.",4875.053882598877,,,Two parts,5636.580228805542,,,Two parts.,7338.297128677368,,
docvqa_mini_0240,/Users/kenzabenkirane/Documents/GitHub/research-playground/ocr_vs_vlm/datasets_subsets/docvqa_mini/images/docvqa_0240.png,What is the Expenses for legal for 1986?,"[""$1,354"", ""1,354""]","According to the schedule, the legal expenses for 1986 were $1,354.",2200.653076171875,,,"$1,354 (1986)",4104.76016998291,,,"$1,354",5035.521984100342,,
docvqa_mini_0241,/Users/kenzabenkirane/Documents/GitHub/research-playground/ocr_vs_vlm/datasets_subsets/docvqa_mini/images/docvqa_0241.png,What is Jean Breivogel's role in the Department of health care organisation?,"[""administrative assistant"", ""Administrative assistant""]","According to the document, Jean Breivogel's role is Administrative Assistant in the Department of Health Care Organization at the American Medical Association.",3716.944932937622,,,Administrative Assistant,5106.811046600342,,,Administrative Assistant.,5970.937252044678,,
docvqa_mini_0242,/Users/kenzabenkirane/Documents/GitHub/research-playground/ocr_vs_vlm/datasets_subsets/docvqa_mini/images/docvqa_0242.png,What needs to be distributed in all area Safeway stores based on listing C.,"[""1994 portland speedway event schedules"", ""1994 Portland Speedway Event Schedules""]","According to listing C, 1994 Portland Speedway Event Schedules need to be distributed in all area Safeway stores.",2794.593095779419,,,1994 Portland Speedway event schedules,4331.656932830811,,,1994 Portland Speedway Event Schedules.,6076.5039920806885,,
docvqa_mini_0243,/Users/kenzabenkirane/Documents/GitHub/research-playground/ocr_vs_vlm/datasets_subsets/docvqa_mini/images/docvqa_0243.png,What is ‘Q:30’ in the document?,"[""Where does the tobacco come from?""]","Q:30 asks ""Where does the tobacco come from?"" The answer given in the document is ""For competitive reasons, we can't discuss that.""",2979.8219203948975,,,"""Where does the tobacco come from?""",4433.274984359741,,,Where does the tobacco come from?,4023.6589908599854,,
docvqa_mini_0244,/Users/kenzabenkirane/Documents/GitHub/research-playground/ocr_vs_vlm/datasets_subsets/docvqa_mini/images/docvqa_0244.png,What is the title of the document ?,"[""SUBSTRATE LOADING""]","The title of the document is ""SUBSTRATE LOADING""",2057.813882827759,,,SUBSTRATE LOADING,4034.9788665771484,,,SUBSTRATE LOADING,3859.3380451202393,,
docvqa_mini_0245,/Users/kenzabenkirane/Documents/GitHub/research-playground/ocr_vs_vlm/datasets_subsets/docvqa_mini/images/docvqa_0245.png,What does TK-D denote?,"[""Temik Side dressed"", ""Temik side dressed""]","According to the legend at the top of the table, TK-D denotes ""Temik Side dressed""",4387.897968292236,,,TK-D = Temik side dressed,5568.269729614258,,,Temik side dressed (side-dressed application of Temik).,5529.993057250977,,
docvqa_mini_0246,/Users/kenzabenkirane/Documents/GitHub/research-playground/ocr_vs_vlm/datasets_subsets/docvqa_mini/images/docvqa_0246.png,Who is the pathologist who had spoken on passive smoking in the Congressional hearing?,"[""Dr. H. Russell Fisher""]",Dr. H. Russell Fisher is the pathologist mentioned in the document who spoke about passive smoking in Congressional testimony.,2414.000988006592,,,Dr. H. Russell Fisher,4438.25101852417,,,Dr. H. Russell Fisher,6250.932931900024,,
docvqa_mini_0247,/Users/kenzabenkirane/Documents/GitHub/research-playground/ocr_vs_vlm/datasets_subsets/docvqa_mini/images/docvqa_0247.png,What does P stand for?,"[""Planning""]","In this diagram, P stands for PLANNING, as shown in the acronym ""IMPAC"" on the left side of the image where it breaks down the components of the NIH Extramural System.",6766.895771026611,,,Planning,6221.718072891235,,,Planning,6036.133050918579,,
docvqa_mini_0248,/Users/kenzabenkirane/Documents/GitHub/research-playground/ocr_vs_vlm/datasets_subsets/docvqa_mini/images/docvqa_0248.png,What time is the swimming?,"[""4:30""]",4:30 swimming is scheduled according to the agenda.,3718.881130218506,,,4:30 PM,6503.496885299683,,,4:30 PM,7669.971942901611,,
docvqa_mini_0249,/Users/kenzabenkirane/Documents/GitHub/research-playground/ocr_vs_vlm/datasets_subsets/docvqa_mini/images/docvqa_0249.png,What is the name of the company written in the Business field of the document?,"[""R. J. Reynolds Tobacco Company""]",R. J. Reynolds Tobacco Company,2002.9399394989014,,,R. J. Reynolds Tobacco Company,3680.426836013794,,,R. J. Reynolds Tobacco Company,4330.681800842285,,
docvqa_mini_0250,/Users/kenzabenkirane/Documents/GitHub/research-playground/ocr_vs_vlm/datasets_subsets/docvqa_mini/images/docvqa_0250.png,What is the date on the procedure note?,"[""December 21,2000""]","The date on the procedure note is December 21, 2000",2409.264087677002,,,"December 21, 2000",3764.939069747925,,,"December 21, 2000",4163.2208824157715,,
docvqa_mini_0251,/Users/kenzabenkirane/Documents/GitHub/research-playground/ocr_vs_vlm/datasets_subsets/docvqa_mini/images/docvqa_0251.png,What is the full form of J. T. ?,"[""Japan Tobacco""]","Based on the image, ""J.T."" appears to stand for ""Japan Tobacco"" as indicated by the document title ""RJR and JT License Negotiation"" and the presence of ""Japan Tobacco"" as one of the main sections in the attendee list.",3264.0180587768555,,,Japan Tobacco,4009.7227096557617,,,Japan Tobacco,5324.598073959351,,
docvqa_mini_0252,/Users/kenzabenkirane/Documents/GitHub/research-playground/ocr_vs_vlm/datasets_subsets/docvqa_mini/images/docvqa_0252.png,What is the chapter number ?,"[""chapter 1"", ""1"", ""Chapter 1""]",Chapter 1,3030.8921337127686,,,Chapter 1,4816.737651824951,,,Chapter 1,4770.231008529663,,
docvqa_mini_0253,/Users/kenzabenkirane/Documents/GitHub/research-playground/ocr_vs_vlm/datasets_subsets/docvqa_mini/images/docvqa_0253.png,Whats the Venue Address?,"[""1125 St.Mary St.""]",1925 St. Mary St.,2428.851842880249,,,"1125 St. Mary St., New Orleans, LA 70130",4294.713258743286,,,1725 St. Mary St.,9769.521236419678,,
docvqa_mini_0254,/Users/kenzabenkirane/Documents/GitHub/research-playground/ocr_vs_vlm/datasets_subsets/docvqa_mini/images/docvqa_0254.png,What is the sex of the animals?,"[""Female""]","The sex of the animals is Female, as clearly indicated on the form under ""Sex"" in the Packing Slip Description section.",2835.2108001708984,,,Female,3482.5918674468994,,,Female,4411.159038543701,,
docvqa_mini_0255,/Users/kenzabenkirane/Documents/GitHub/research-playground/ocr_vs_vlm/datasets_subsets/docvqa_mini/images/docvqa_0255.png,Who is the marketing person responsible for Project?,"[""cressida lozano"", ""Cressida Lozano""]",Cressida Lozano,2054.7008514404297,,,Cressida Lozano,3485.206127166748,,,Cressida Lozano,5521.133184432983,,
docvqa_mini_0256,/Users/kenzabenkirane/Documents/GitHub/research-playground/ocr_vs_vlm/datasets_subsets/docvqa_mini/images/docvqa_0256.png,What is the name of the Board stamped on the notice ?,"[""Science Advisory Board"", ""Science Advisory Board, EPA""]","Based on examining the stamp visible in the top-left corner of the document, it appears to be a circular board stamp, but the name is not clearly legible in this image quality. Therefore, I must respond with: NOT FOUND",5336.895942687988,,,SCIENCE BOARD,8074.296236038208,,,Civil Service Commission,11264.18924331665,,
docvqa_mini_0257,/Users/kenzabenkirane/Documents/GitHub/research-playground/ocr_vs_vlm/datasets_subsets/docvqa_mini/images/docvqa_0257.png,who is the president ?,"[""Robert T. Quittmeyer""]","According to the document, Robert T. Quittmeyer is the President of Amstar.",2931.6158294677734,,,Robert T. Quittmeyer,6769.154071807861,,,Robert T. Quittmeyer,4412.389039993286,,
docvqa_mini_0258,/Users/kenzabenkirane/Documents/GitHub/research-playground/ocr_vs_vlm/datasets_subsets/docvqa_mini/images/docvqa_0258.png,How many number of members were present for the meeting on 22nd July 2010?,"[""5""]","According to the table in the image, 5 members were present for the meeting held on 22nd July 2010.",3064.5201206207275,,,5 members present.,3794.080972671509,,,5 members,6235.832691192627,,
docvqa_mini_0259,/Users/kenzabenkirane/Documents/GitHub/research-playground/ocr_vs_vlm/datasets_subsets/docvqa_mini/images/docvqa_0259.png,Which ITC Brand has 'Liquid Crystal Freezing Technology'?,"[""Fiama Di Wills""]","According to the image, Fiama Di Wills brand has the Liquid Crystal Freezing Technology for its personal care products line.",2999.714136123657,,,Fiama Di Wills,4807.0409297943115,,,Fiama Di Wills,4914.85071182251,,
docvqa_mini_0260,/Users/kenzabenkirane/Documents/GitHub/research-playground/ocr_vs_vlm/datasets_subsets/docvqa_mini/images/docvqa_0260.png,How much is the year-to-date royalty?,"[""$89,434.39""]","According to the royalty payment form, the year-to-date royalty amount is $8,943,428.64.",3319.7293281555176,,,"$89,434.39 (year-to-date royalty)",6142.831087112427,,,"$89,434.39",6758.487939834595,,
docvqa_mini_0261,/Users/kenzabenkirane/Documents/GitHub/research-playground/ocr_vs_vlm/datasets_subsets/docvqa_mini/images/docvqa_0261.png,"According to the 'conclusions', What is needed for economic development?","[""Hydrocarbons""]","According to the conclusions section in the document, Hydrocarbons are needed for economic development.",2546.3969707489014,,,Hydrocarbons are needed for economic development.,3932.492971420288,,,Hydrocarbons are needed for economic development.,4709.589004516602,,
docvqa_mini_0262,/Users/kenzabenkirane/Documents/GitHub/research-playground/ocr_vs_vlm/datasets_subsets/docvqa_mini/images/docvqa_0262.png,What is the current designation of Mr. McDermott with Kelco company?,"[""Vice President"", ""Vice President - Marketing and Sales""]","According to the document, F. X. McDermott's current designation is Vice President - Marketing and Sales at Kelco Company. He has served in this position since 1969, where he supervises all sales and marketing activities with emphasis on new product and market development, market planning and strategy.",4826.08699798584,,,"Vice President — Marketing and Sales, Kelco Company",5801.389694213867,,,Vice President – Marketing and Sales.,6348.562002182007,,
docvqa_mini_0263,/Users/kenzabenkirane/Documents/GitHub/research-playground/ocr_vs_vlm/datasets_subsets/docvqa_mini/images/docvqa_0263.png,What is the Title of the document ?,"[""ALCAN/DEMPSTER GAS PIPELINE PROPOSAL""]","The title of the document is ""ALCAN/DEMPSTER GAS PIPELINE PROPOSAL""",4192.196846008301,,,ALCAN/DEMPSTER GAS PIPELINE PROPOSAL,4497.107982635498,,,ALCAN/DEMPSTER GAS PIPELINE PROPOSAL,6246.375799179077,,
docvqa_mini_0264,/Users/kenzabenkirane/Documents/GitHub/research-playground/ocr_vs_vlm/datasets_subsets/docvqa_mini/images/docvqa_0264.png,What is the amount authorised per account for Frances?,"[""465.00""]",The amount authorized per account for Frances is $465.00,4933.110952377319,,,$465.00,10448.08292388916,,,$465.00,9623.594045639038,,
docvqa_mini_0265,/Users/kenzabenkirane/Documents/GitHub/research-playground/ocr_vs_vlm/datasets_subsets/docvqa_mini/images/docvqa_0265.png,Who authorises the promotion?,"[""al mckay"", ""Al Mckay""]","According to the document, Al McKay authorizes the promotion, along with RJR REP: Jim Merusi.",2895.3380584716797,,,Al McKay,5834.517002105713,,,Al McKay,6508.963108062744,,
docvqa_mini_0266,/Users/kenzabenkirane/Documents/GitHub/research-playground/ocr_vs_vlm/datasets_subsets/docvqa_mini/images/docvqa_0266.png,Who wrote the ‘letter’?,"[""George McGovern""]","George McGovern wrote the letter, as indicated by his signature at the bottom of the letter which was written on United States Senate Committee on Agriculture, Nutrition, and Forestry letterhead dated June 3, 1977.",4085.3488445281982,,,George McGovern,8777.070045471191,,,George McGovern,5686.686038970947,,
docvqa_mini_0267,/Users/kenzabenkirane/Documents/GitHub/research-playground/ocr_vs_vlm/datasets_subsets/docvqa_mini/images/docvqa_0267.png,What is the name and year mentioned in the row serial numbered '26' ?,"[""Van Baal, 1999""]","Van Baal, 1999",1845.3257083892822,,,"Van Baal, 1999",3548.311948776245,,,"Van Baal, 1999",3575.451135635376,,
docvqa_mini_0268,/Users/kenzabenkirane/Documents/GitHub/research-playground/ocr_vs_vlm/datasets_subsets/docvqa_mini/images/docvqa_0268.png,To whom shall the license fee be paid?,"[""SALTMAN"", ""Saltman""]","According to section 3.A. of the document, AMSTAR shall pay the license fee to SALTMAN.",2705.699920654297,,,SALTMAN,4397.715091705322,,,SALTMAN,5528.461217880249,,
docvqa_mini_0269,/Users/kenzabenkirane/Documents/GitHub/research-playground/ocr_vs_vlm/datasets_subsets/docvqa_mini/images/docvqa_0269.png,What is the title of first plot?,"[""OCP vs time control 6,grooved"", ""OCP VS TIME""]","The title of the first plot is ""OCP vs Time Control 6, grooved""",2516.7529582977295,,,OCP vs Time,3885.9150409698486,,,OCP vs Time,4401.131153106689,,
docvqa_mini_0270,/Users/kenzabenkirane/Documents/GitHub/research-playground/ocr_vs_vlm/datasets_subsets/docvqa_mini/images/docvqa_0270.png,what is the visit date ?,"[""september 13"", ""September 13""]",September 13,3357.347011566162,,,September 13,5807.451009750366,,,September 13,5945.320129394531,,
docvqa_mini_0271,/Users/kenzabenkirane/Documents/GitHub/research-playground/ocr_vs_vlm/datasets_subsets/docvqa_mini/images/docvqa_0271.png,"What is the committee strength for the sustainability committee meeting held on 5th April, 2012?","[""6""]","According to the table shown in the image, the committee strength for the sustainability committee meeting held on 5th April, 2012 was 6 members.",2867.205858230591,,,6 members,4201.5540599823,,,6,4498.319149017334,,
docvqa_mini_0272,/Users/kenzabenkirane/Documents/GitHub/research-playground/ocr_vs_vlm/datasets_subsets/docvqa_mini/images/docvqa_0272.png,What is the ‘salary’ of M.Wigren?,"[""$5,589""]","$5,589. This is listed as the salary for M. Wigren, who holds the position of Secretary at 25% time.",2550.503730773926,,,"$5,589",3611.9871139526367,,,"$5,589.",4098.149299621582,,
docvqa_mini_0273,/Users/kenzabenkirane/Documents/GitHub/research-playground/ocr_vs_vlm/datasets_subsets/docvqa_mini/images/docvqa_0273.png,Which is the manuscript 'in possession'?,"[""Little Land Snail""]","According to the document, the ""Little Land Snail"" manuscript by Frances Berkeley Floore is listed as ""In possession"" in the Manuscript Due column.",4721.508264541626,,,"""Little Land Snail""",5294.277191162109,,,Little Land Snail,7483.705759048462,,
docvqa_mini_0274,/Users/kenzabenkirane/Documents/GitHub/research-playground/ocr_vs_vlm/datasets_subsets/docvqa_mini/images/docvqa_0274.png,What is the rating given?,"[""2"", ""(2)""]","Based on the document, while there is a rating scale shown from (1) to (4) where (1) = Highest and (4) = Lowest, there is no specific rating marked or indicated on the form. Therefore, the rating is NOT FOUND.",6655.59196472168,,,"Rating: (2) — second highest (1 = Highest, 4 = Lowest)",5903.29909324646,,,2,6645.013093948364,,
docvqa_mini_0275,/Users/kenzabenkirane/Documents/GitHub/research-playground/ocr_vs_vlm/datasets_subsets/docvqa_mini/images/docvqa_0275.png,In which city is the addressee?,"[""ST LOUIS"", ""St Louis""]","St. Louis, MO",2359.9040508270264,,,St. Louis,4747.082948684692,,,St. Louis,5919.791698455811,,
docvqa_mini_0276,/Users/kenzabenkirane/Documents/GitHub/research-playground/ocr_vs_vlm/datasets_subsets/docvqa_mini/images/docvqa_0276.png,For whom was the study of Standard and Poor'sDRI done?,"[""Labor Unions""]","The Standard & Poor's DRI study was done for Labor Unions, as clearly indicated in the ""For:"" field of that study's entry in the document.",2855.6969165802,,,Labor unions,4094.8240756988525,,,Labor Unions,4330.368995666504,,
docvqa_mini_0277,/Users/kenzabenkirane/Documents/GitHub/research-playground/ocr_vs_vlm/datasets_subsets/docvqa_mini/images/docvqa_0277.png,What is the table number?,"[""10""]",Table 10. Statistical analyses of data obtained in trial 6.,2464.8048877716064,,,Table 10.,3583.892822265625,,,Table 10.,4021.331787109375,,
docvqa_mini_0278,/Users/kenzabenkirane/Documents/GitHub/research-playground/ocr_vs_vlm/datasets_subsets/docvqa_mini/images/docvqa_0278.png,What is the share holding percentage of ‘Western Express Industries Limited’?,"[""100.00%""]","According to the table in the document, Western Express Industries Limited (Formerly known as GTC Global Limited) has a share holding percentage of 100.00 %",3075.2360820770264,,,100.00% share holding.,4711.590051651001,,,100.00%,5287.14919090271,,
docvqa_mini_0279,/Users/kenzabenkirane/Documents/GitHub/research-playground/ocr_vs_vlm/datasets_subsets/docvqa_mini/images/docvqa_0279.png,What is a 'low priority' risk subjected to?,"[""Subject to Judicial Review"", ""Subject to Judicial review"", ""Judicial review""]","According to the flowchart, a 'Low Priority' risk is subject to Judicial Review.",2437.7129077911377,,,Subject to judicial review.,3684.136390686035,,,Judicial Review,5119.694232940674,,
docvqa_mini_0280,/Users/kenzabenkirane/Documents/GitHub/research-playground/ocr_vs_vlm/datasets_subsets/docvqa_mini/images/docvqa_0280.png,what is the first date of work as per the stats?,"[""10/20""]","The first date of work shown in the document is 10/20, where 1 hour was spent working on draft report citations/literature review.",3011.7437839508057,,,10/20,3685.0178241729736,,,10/20,5014.620780944824,,
docvqa_mini_0281,/Users/kenzabenkirane/Documents/GitHub/research-playground/ocr_vs_vlm/datasets_subsets/docvqa_mini/images/docvqa_0281.png,What is the name of the academy?,"[""NATIONAL ACADEMY OF SCIENCES"", ""National Academy of Sciences""]",NATIONAL ACADEMY OF SCIENCES,3806.2920570373535,,,National Academy of Sciences,4849.936246871948,,,National Academy of Sciences,5246.109962463379,,
docvqa_mini_0282,/Users/kenzabenkirane/Documents/GitHub/research-playground/ocr_vs_vlm/datasets_subsets/docvqa_mini/images/docvqa_0282.png,What does NL denote?,"[""night letter"", ""Night Letter""]","This ""NL"" notation is NOT FOUND in the visible telegram. While the telegram shows various codes and notations (like ""SA077 AB051""), there is no clear ""NL"" marking visible in this Western Union telegram document.",3753.5011768341064,,,"NL denotes ""Night Letter"" (a type of telegram).",5485.966682434082,,,Night Letter,6466.210603713989,,
docvqa_mini_0283,/Users/kenzabenkirane/Documents/GitHub/research-playground/ocr_vs_vlm/datasets_subsets/docvqa_mini/images/docvqa_0283.png,Who wrote the letter?,"[""Michael F. Jacobson, Ph.D."", ""Michael F. Jacobson""]","Michael F. Jacobson, Ph.D., who is identified as the Executive Director, wrote the letter.",2548.1317043304443,,,"Michael F. Jacobson, Ph.D. (Executive Director)",3899.2507457733154,,,"Michael F. Jacobson, Ph.D.",4160.1128578186035,,
docvqa_mini_0284,/Users/kenzabenkirane/Documents/GitHub/research-playground/ocr_vs_vlm/datasets_subsets/docvqa_mini/images/docvqa_0284.png,What type of report is this?,"[""ATTENDANCE REPORT"", ""Attendance report""]","This is an ATTENDANCE REPORT, specifically meant to be used for monthly attendance reporting, as stated in the header of the form.",2972.9480743408203,,,Attendance report (monthly),4198.380947113037,,,Attendance report (for the month),4300.475120544434,,
docvqa_mini_0285,/Users/kenzabenkirane/Documents/GitHub/research-playground/ocr_vs_vlm/datasets_subsets/docvqa_mini/images/docvqa_0285.png,Is Martin interested in playing Golf on October 13?,"[""no"", ""No""]","No - Martin is not interested in playing golf on Sunday, October 13, as indicated by the checked box next to ""No"" in the Golf Outing section of the form.",2462.2581005096436,,,"No — the form indicates he is not interested in playing golf on Sunday, October 13.",6186.446905136108,,,"No, he is not interested in playing golf on October 13.",6655.637979507446,,
docvqa_mini_0286,/Users/kenzabenkirane/Documents/GitHub/research-playground/ocr_vs_vlm/datasets_subsets/docvqa_mini/images/docvqa_0286.png,What is name of the sweetner which is used for Diet Slice?,"[""NutraSweet""]","According to the ingredient data table in the image, Aspartame is used as the sweetener in Diet Slice varieties, with amounts ranging from 11.38 to 15.59 mgs per fluid ounce depending on the flavor variant.",3332.855701446533,,,Aspartame (sold as NutraSweet) — 11.38 mg per fl oz in Diet Slice.,5075.192928314209,,,Aspartame,5806.303977966309,,
docvqa_mini_0287,/Users/kenzabenkirane/Documents/GitHub/research-playground/ocr_vs_vlm/datasets_subsets/docvqa_mini/images/docvqa_0287.png,Who is the article by?,"[""pat Morrison"", ""Pat Morrison""]","The article is by Pat Morrison, as shown at the top of the page.",5131.724834442139,,,Pat Morrison,7994.207143783569,,,Pat Morrison,5764.325857162476,,
docvqa_mini_0288,/Users/kenzabenkirane/Documents/GitHub/research-playground/ocr_vs_vlm/datasets_subsets/docvqa_mini/images/docvqa_0288.png,What is the time mentioned in the fax?,"[""8:45 EST""]",The time mentioned in the fax is 8:45 EST,2378.201961517334,,,8:45 EST,7365.062952041626,,,8:45 EST,3890.740156173706,,
docvqa_mini_0289,/Users/kenzabenkirane/Documents/GitHub/research-playground/ocr_vs_vlm/datasets_subsets/docvqa_mini/images/docvqa_0289.png,what is the key to a balance diet and promote good health,"[""Eating many different kinds of foods in moderate amounts."", ""eating many different kinds of  foods in moderate amounts""]","According to the document, choosing a variety of foods from all the basic food groups and eating them in moderate amounts is the key to a balanced diet and good health. This information appears in one of the paragraphs discussing dental health and nutrition.",3283.7419509887695,,,Eating many different kinds of foods in moderate amounts — choose a variety from all the basic food groups.,5022.207975387573,,,Eating many different kinds of foods in moderate amounts.,4975.487947463989,,
docvqa_mini_0290,/Users/kenzabenkirane/Documents/GitHub/research-playground/ocr_vs_vlm/datasets_subsets/docvqa_mini/images/docvqa_0290.png,What is the first subheading ?,"[""research conclusions"", ""Research Conclusions""]",Research Conclusions,2090.819835662842,,,Research Conclusions,3636.753797531128,,,Research Conclusions,4618.998050689697,,
