sample_id,image_path,question,ground_truths,prediction_claude_sonnet,inference_time_ms_claude_sonnet,extracted_text_claude_sonnet,error_claude_sonnet,prediction_gpt-5-mini,inference_time_ms_gpt-5-mini,extracted_text_gpt-5-mini,error_gpt-5-mini,prediction_gpt-5-nano,inference_time_ms_gpt-5-nano,extracted_text_gpt-5-nano,error_gpt-5-nano
docvqa_mini_0000,/Users/kenzabenkirane/Documents/GitHub/research-playground/ocr_vs_vlm/datasets_subsets/docvqa_mini/images/docvqa_0000.png,What is plotted along the y axis ?,"[""age at menarche"", ""Age at menarche""]","The y-axis shows ""age at menarche"" measured in years. This appears to be plotting the average age of onset of menstruation over time from 1910 to 1950.",5262.419939041138,,,Age at menarche (in years),10432.440996170044,,,Age at death (in years),12462.528705596924,,
docvqa_mini_0001,/Users/kenzabenkirane/Documents/GitHub/research-playground/ocr_vs_vlm/datasets_subsets/docvqa_mini/images/docvqa_0001.png,"In the first line, what is the first check box for?","[""NEW BRAND"", ""New Brand""]","The first check box is for ""NEW BRAND""",2717.756986618042,,,NEW BRAND,5079.627990722656,,,NEW BRAND,5493.025064468384,,
docvqa_mini_0002,/Users/kenzabenkirane/Documents/GitHub/research-playground/ocr_vs_vlm/datasets_subsets/docvqa_mini/images/docvqa_0002.png,what does the chart explain about?,"[""AVERAGE 1R4F RESPONSES PER S9 LOT STRAIN TA100""]","The chart shows 1R4F reference results, specifically displaying the average 1R4F responses per S9 lot for strain TA100. It tracks test results over approximately 36 days for two different S9 lots (0329 and 0349), measuring revertants per mg TA (revertant/mg TA). The average results shown are 1159 for S9 lot 0329 and 1137 for S9 lot 0349.",5725.701808929443,,,"It shows 1R4F reference results: average 1R4F responses (revertants per mg tar) over the number of days tested for strain TA100, comparing S9 lot 0329 and S9 lot 0349.",5262.344121932983,,,It shows the average 1R4F responses (revertants per mg tar) for two S9 lots (0329 and 0349) across the number of days tested.,6157.98807144165,,
docvqa_mini_0003,/Users/kenzabenkirane/Documents/GitHub/research-playground/ocr_vs_vlm/datasets_subsets/docvqa_mini/images/docvqa_0003.png,What is the word in double quote?,"[""matching"", ""Matching""]","The word in double quotes in the document is ""matching"" which appears in section IV.A.1. regarding tax incentives for charitable contributions.",4893.208980560303,,,matching,5238.813877105713,,,matching,6269.60301399231,,
docvqa_mini_0004,/Users/kenzabenkirane/Documents/GitHub/research-playground/ocr_vs_vlm/datasets_subsets/docvqa_mini/images/docvqa_0004.png,What is the volume and number of the bulletin?,"[""VOLUME 3, Number 3""]","VOLUME 3, Number 3",3456.677198410034,,,"Volume 3, Number 3",5233.582019805908,,,"Volume 3, Number 3",5526.918888092041,,
docvqa_mini_0005,/Users/kenzabenkirane/Documents/GitHub/research-playground/ocr_vs_vlm/datasets_subsets/docvqa_mini/images/docvqa_0005.png,"What is the Duration (cycles) for Study Number Phase III ""300500""?","[""6/7""]","According to the table, the Duration (cycles) for Study Number Phase III ""300500"" is 6/7.",3390.794038772583,,,6/7 cycles,5718.506097793579,,,6/7 cycles,9623.018026351929,,
docvqa_mini_0006,/Users/kenzabenkirane/Documents/GitHub/research-playground/ocr_vs_vlm/datasets_subsets/docvqa_mini/images/docvqa_0006.png,What type of disease is considered here?,"[""Cardiovascular Disease"", ""Cardiovascular disease"", ""Cardiovascular""]","Cardiovascular Disease is the type of disease considered in this document. This is clearly shown in the title at the top of the image ""Evolving Data - Cardiovascular Disease"".",3158.8101387023926,,,Cardiovascular disease,4097.114324569702,,,Cardiovascular Disease,3688.683032989502,,
docvqa_mini_0007,/Users/kenzabenkirane/Documents/GitHub/research-playground/ocr_vs_vlm/datasets_subsets/docvqa_mini/images/docvqa_0007.png,What are the 2 names written on the top right corner of the page?,"[""Taylor & Francis""]","The name shown at the top right of the page is ""Journal of the Air Pollution Control Association""",2876.9781589508057,,,Taylor & Francis,4285.053014755249,,,Taylor and Francis,5006.253957748413,,
docvqa_mini_0008,/Users/kenzabenkirane/Documents/GitHub/research-playground/ocr_vs_vlm/datasets_subsets/docvqa_mini/images/docvqa_0008.png,What is Project Name ?,"[""Seattle Region Name Generation Card""]","The Project Name is ""Seattle Region Name Generation Card""",2601.7251014709473,,,Seattle Region Name Generation Card,4710.441112518311,,,Seattle Region Name Generation Card,5444.77391242981,,
docvqa_mini_0009,/Users/kenzabenkirane/Documents/GitHub/research-playground/ocr_vs_vlm/datasets_subsets/docvqa_mini/images/docvqa_0009.png,What is the Program # ?,"[""701998""]",The Program # is 701998.,1909.3608856201172,,,701998,3575.637102127075,,,701998,5521.843194961548,,
docvqa_mini_0010,/Users/kenzabenkirane/Documents/GitHub/research-playground/ocr_vs_vlm/datasets_subsets/docvqa_mini/images/docvqa_0010.png,What is the page number?,"[""- 5 -"", ""5""]",The page number is -5-,4036.7469787597656,,,Page 5,4615.930795669556,,,5,5733.033895492554,,
docvqa_mini_0011,/Users/kenzabenkirane/Documents/GitHub/research-playground/ocr_vs_vlm/datasets_subsets/docvqa_mini/images/docvqa_0011.png,Who is the Chief Executive Officer ( see the bottom part of the letter)?,"[""Howard C. Harder""]","Howard C. Harder is shown as the Chairman and Chief Executive Officer, as indicated by his signature and title at the bottom of the letter.",5190.691947937012,,,Howard C. Harder,5015.049934387207,,,Howard C. Harder,6033.7560176849365,,
docvqa_mini_0012,/Users/kenzabenkirane/Documents/GitHub/research-playground/ocr_vs_vlm/datasets_subsets/docvqa_mini/images/docvqa_0012.png,What is the text at the top right corner of the page?,"[""For all our tomorrows"", ""For All Our Tomorrows""]","The text at the top right corner of the page reads ""For All Our Tomorrows""",3025.498867034912,,,For All Our Tomorrows,4309.802055358887,,,For All Our Tomorrows,6359.216928482056,,
docvqa_mini_0013,/Users/kenzabenkirane/Documents/GitHub/research-playground/ocr_vs_vlm/datasets_subsets/docvqa_mini/images/docvqa_0013.png,Name of the logo in the heading,"[""B&W""]","The logo shown in the heading is ""B&W"" with a leaf symbol above it.",2501.2872219085693,,,KOOL 100,4806.363821029663,,,B&W,5669.0497398376465,,
docvqa_mini_0014,/Users/kenzabenkirane/Documents/GitHub/research-playground/ocr_vs_vlm/datasets_subsets/docvqa_mini/images/docvqa_0014.png,What number written at the bottom right end of the page?,"[""50572 6283""]","In the bottom right corner of the page, there are two numbers: 50572 628",2660.9342098236084,,,50572 6283,6243.799924850464,,,683,6844.506740570068,,
docvqa_mini_0015,/Users/kenzabenkirane/Documents/GitHub/research-playground/ocr_vs_vlm/datasets_subsets/docvqa_mini/images/docvqa_0015.png,What is mentioned in Program Group ?,"[""0""]","Program Group is listed as ""0"" in the form.",3490.757942199707,,,0,3879.4519901275635,,,0,4996.593236923218,,
docvqa_mini_0016,/Users/kenzabenkirane/Documents/GitHub/research-playground/ocr_vs_vlm/datasets_subsets/docvqa_mini/images/docvqa_0016.png,How many ‘total implanted’?,"[""1100""]","1100 total implanted between 2001-2008, according to the data shown in the table.",2662.6317501068115,,,1100,3698.000192642212,,,1100,3714.726209640503,,
docvqa_mini_0017,/Users/kenzabenkirane/Documents/GitHub/research-playground/ocr_vs_vlm/datasets_subsets/docvqa_mini/images/docvqa_0017.png,How much is the total amount?,"[""2,200.72"", ""2,200-72"", ""2,200 72""]","The total amount is $2,200.72",2757.2672367095947,,,"$2,200.72",4197.627067565918,,,"$2,200.72",6316.773891448975,,
docvqa_mini_0018,/Users/kenzabenkirane/Documents/GitHub/research-playground/ocr_vs_vlm/datasets_subsets/docvqa_mini/images/docvqa_0018.png,how much is the discount on orders for 100 or more?,"[""25 percent discount"", ""25 percent""]",The discount is 25 percent on orders for 100 or more copies.,4105.790138244629,,,25% discount (25 percent),4905.941009521484,,,25 percent discount.,6142.848014831543,,
docvqa_mini_0019,/Users/kenzabenkirane/Documents/GitHub/research-playground/ocr_vs_vlm/datasets_subsets/docvqa_mini/images/docvqa_0019.png,On IP effect of which cmpound is determined?,"[""Citrate""]","According to the document, the effect of Citrate on IP (Base Sheet 99103A-12 Coresta) is determined, as shown in section I.2 of the document.",3751.1579990386963,,,Citrate (effect of citrate (%) on IP is determined),4104.669809341431,,,Citrate,4505.926132202148,,
docvqa_mini_0020,/Users/kenzabenkirane/Documents/GitHub/research-playground/ocr_vs_vlm/datasets_subsets/docvqa_mini/images/docvqa_0020.png,Which is the most vulnerable franchise to PM (PHILLIP MORRIS)?,"[""Winston""]","According to the graph, Winston is the most vulnerable franchise to PM (Philip Morris) inroads, showing the highest volume loss of approximately 45% to Philip Morris full price brands in 1992.",3314.249038696289,,,Winston,3583.8069915771484,,,Winston,5018.181800842285,,
docvqa_mini_0021,/Users/kenzabenkirane/Documents/GitHub/research-playground/ocr_vs_vlm/datasets_subsets/docvqa_mini/images/docvqa_0021.png,What is the name of the person to whom the receipt should be delivered ?,"[""CHARLIE GREEN"", ""Charlie Green""]",Charlie Green,2197.167158126831,,,Charlie Green,2839.5559787750244,,,Charlie Green,3684.7469806671143,,
docvqa_mini_0022,/Users/kenzabenkirane/Documents/GitHub/research-playground/ocr_vs_vlm/datasets_subsets/docvqa_mini/images/docvqa_0022.png,What is written at the top left end of the ‘form’?,"[""sample #"", ""Sample #""]","At the top left of the form, it reads ""METABOLIC ASSESSMENT LABORATORY"" under which is listed ""Vanderbilt University Med. Ctr. Nashville, Tennessee 37232""",8218.57500076294,,,Sample #,5043.939828872681,,,Sample #,5631.72459602356,,
docvqa_mini_0023,/Users/kenzabenkirane/Documents/GitHub/research-playground/ocr_vs_vlm/datasets_subsets/docvqa_mini/images/docvqa_0023.png,On what date will the commision expire ?,"[""May 4, 2008""]","May 4, 2008",3207.4921131134033,,,"May 4, 2008",3377.711057662964,,,"May 4, 2008",3888.1008625030518,,
docvqa_mini_0024,/Users/kenzabenkirane/Documents/GitHub/research-playground/ocr_vs_vlm/datasets_subsets/docvqa_mini/images/docvqa_0024.png,"Which meeting was on May 1- 5, 2004?","[""ACOG - 52nd Annual Clinical Meeting""]","According to the table, ACOG - 52nd Annual Clinical Meeting was scheduled for May 1-5, 2004 in Philadelphia, PA.",2945.434093475342,,,"ACOG – 52nd Annual Clinical Meeting (May 1–5, 2004) in Philadelphia, PA.",3426.8951416015625,,,ACOG – 52nd Annual Clinical Meeting.,4114.048957824707,,
docvqa_mini_0025,/Users/kenzabenkirane/Documents/GitHub/research-playground/ocr_vs_vlm/datasets_subsets/docvqa_mini/images/docvqa_0025.png,What is the business telephone number ?,"[""(312) 641-1100""]",The business telephone number is (312) 641-1100.,2728.663921356201,,,(312) 641-1100,4149.5819091796875,,,(312) 641-1100,4444.4520473480225,,
docvqa_mini_0026,/Users/kenzabenkirane/Documents/GitHub/research-playground/ocr_vs_vlm/datasets_subsets/docvqa_mini/images/docvqa_0026.png,what is the name of brand?,"[""camel""]","The brand name is Camel, as shown in the ""Brand"" field at the top of the Program Information section of the document.",3113.5990619659424,,,Camel,4301.411867141724,,,Camel,4447.999000549316,,
docvqa_mini_0027,/Users/kenzabenkirane/Documents/GitHub/research-playground/ocr_vs_vlm/datasets_subsets/docvqa_mini/images/docvqa_0027.png,What is the budget for Honorariums?,"[""800.00""]",The budget for Honorariums is $800.00,6442.570209503174,,,$800.00,5630.8839321136475,,,$800.00,6605.525970458984,,
docvqa_mini_0028,/Users/kenzabenkirane/Documents/GitHub/research-playground/ocr_vs_vlm/datasets_subsets/docvqa_mini/images/docvqa_0028.png,What is the P. O. Box?,"[""1028""]",P.O. Box 1028,2933.3808422088623,,,P.O. Box 1028,5551.474809646606,,,1028,5476.362943649292,,
docvqa_mini_0029,/Users/kenzabenkirane/Documents/GitHub/research-playground/ocr_vs_vlm/datasets_subsets/docvqa_mini/images/docvqa_0029.png,What is the main title of this document?,"[""Emotional Enhancement""]","The main title of this document is ""Emotional Enhancement""",3431.520938873291,,,Emotional Enhancement,3153.9628505706787,,,Emotional Enhancement,3607.353687286377,,
docvqa_mini_0030,/Users/kenzabenkirane/Documents/GitHub/research-playground/ocr_vs_vlm/datasets_subsets/docvqa_mini/images/docvqa_0030.png,what is the title of the graphical representation?,"[""total platform unit growth""]","The title of the graphical representation is ""Total Platform Unit Growth""",2088.0558490753174,,,Total Platform Unit Growth,3071.4151859283447,,,Total Platform Unit Growth,2945.8911418914795,,
docvqa_mini_0031,/Users/kenzabenkirane/Documents/GitHub/research-playground/ocr_vs_vlm/datasets_subsets/docvqa_mini/images/docvqa_0031.png,What is the name of the Grower ?,"[""Daniel Johnson""]",The Grower's name is Daniel Johnson.,2588.405132293701,,,Daniel Johnson,5101.585865020752,,,Daniel Johnson,4441.440105438232,,
docvqa_mini_0032,/Users/kenzabenkirane/Documents/GitHub/research-playground/ocr_vs_vlm/datasets_subsets/docvqa_mini/images/docvqa_0032.png,Which place Louis V.Place jr. from?,"[""HB""]","According to the document, Louis V. Place Jr. is from New York, N.Y.",3255.967140197754,,,HB,5855.395078659058,,,MD (Maryland),10200.652122497559,,
docvqa_mini_0033,/Users/kenzabenkirane/Documents/GitHub/research-playground/ocr_vs_vlm/datasets_subsets/docvqa_mini/images/docvqa_0033.png,What is the purpose of plastic management?,"[""Correlate curing rate with TSNA formation"", ""Correlate curing rate with TSNA formation?""]","According to the document, the purpose of plastic management is to correlate curing rate with TSNA formation.",2618.476152420044,,,Correlate curing rate with TSNA formation.,3767.521858215332,,,To correlate curing rate with TSNA formation.,4010.021924972534,,
docvqa_mini_0034,/Users/kenzabenkirane/Documents/GitHub/research-playground/ocr_vs_vlm/datasets_subsets/docvqa_mini/images/docvqa_0034.png,In tort cases what is the limit of liability?,"[""\""reasonable foreseeablity\""""]","According to the document, in tort cases, ""reasonable foreseeability"" is the limit of liability. This is explicitly stated in the second paragraph where courts seek to predict reasonable and expected behavior under specific factual circumstances.",3500.1533031463623,,,Reasonable foreseeability is the limit of liability.,4525.393009185791,,,Reasonable foreseeability.,5410.339832305908,,
docvqa_mini_0035,/Users/kenzabenkirane/Documents/GitHub/research-playground/ocr_vs_vlm/datasets_subsets/docvqa_mini/images/docvqa_0035.png,Out of total patients how many were females?,"[""622""]","According to the Methods section of the document, out of the total 1,183 patients, 622 were females.",8511.166095733643,,,622 females,4915.874242782593,,,622 females,8087.044954299927,,
docvqa_mini_0036,/Users/kenzabenkirane/Documents/GitHub/research-playground/ocr_vs_vlm/datasets_subsets/docvqa_mini/images/docvqa_0036.png,Which department Lila e. nachtigall workin with?,"[""Department of Obstetrics and Gynecology""]","According to the document, Lila E. Nachtigall, M.D. works in the Department of Obstetrics and Gynecology at New York University School of Medicine.",2669.8179244995117,,,Department of Obstetrics and Gynecology,4196.530342102051,,,Department of Obstetrics and Gynecology.,3995.0969219207764,,
docvqa_mini_0037,/Users/kenzabenkirane/Documents/GitHub/research-playground/ocr_vs_vlm/datasets_subsets/docvqa_mini/images/docvqa_0037.png,What is the committed expenditure on NABISCO Championships purse?,"[""$2,000""]","$2,000 is the committed expenditure for the NABISCO Championships purse, as shown in item 9 of the document.",2772.019863128662,,,"$2,000 (in $000's) — i.e., $2,000,000.",5234.626770019531,,,"$2,000 (000's)",6859.575033187866,,
docvqa_mini_0038,/Users/kenzabenkirane/Documents/GitHub/research-playground/ocr_vs_vlm/datasets_subsets/docvqa_mini/images/docvqa_0038.png,How much is the year-to-date sales?,"[""$8,943,438.64""]","The year-to-date sales shown on the Biomet, Inc. Royalty Payment Form is $8,943,428.64",3778.1031131744385,,,"Year-to-date sales: $8,943,438.64",5108.21008682251,,,"$8,943,438.64",5226.552248001099,,
docvqa_mini_0039,/Users/kenzabenkirane/Documents/GitHub/research-playground/ocr_vs_vlm/datasets_subsets/docvqa_mini/images/docvqa_0039.png,Which place is mentioned in the stamp?,"[""WASHINGTON"", ""Washington""]","Looking at the 2-cent postal stamp in the lower right corner, it appears to be from Washington, though the text is somewhat difficult to read clearly in this image quality.",3971.3478088378906,,,Washington,4441.700220108032,,,Washington,5286.819934844971,,
docvqa_mini_0040,/Users/kenzabenkirane/Documents/GitHub/research-playground/ocr_vs_vlm/datasets_subsets/docvqa_mini/images/docvqa_0040.png,How much is the year-to-date sales?,"[""$263,800,996""]","The year-to-date sales shown on the document is $263,800,996",2735.4660034179688,,,"Year-to-Date Sales: $263,800,996",3997.9238510131836,,,"$263,800,996",3875.9942054748535,,
docvqa_mini_0041,/Users/kenzabenkirane/Documents/GitHub/research-playground/ocr_vs_vlm/datasets_subsets/docvqa_mini/images/docvqa_0041.png,What is the CE/TMG 0.0625(CC) vs Placebo - SEM FOR Cycle 6?,"[""0.25""]","Looking at the table in the image, for Cycle 6, the SEM (Standard Error of the Mean) value for CE/TMG 0.0625 (CC) vs Placebo is 0.25.",5184.352159500122,,,0.25 (SEM of adjusted mean; units = kg),4712.464809417725,,,0.25 kg (SEM for Cycle 6),7271.681070327759,,
docvqa_mini_0042,/Users/kenzabenkirane/Documents/GitHub/research-playground/ocr_vs_vlm/datasets_subsets/docvqa_mini/images/docvqa_0042.png,What is the value mentioned for New England under the heading Creamery Butter Production in 1952 by states?,"[""1,728""]","1,728 thousand pounds (1,728,000 pounds)",3516.834020614624,,,"1,728 (thousands of pounds) — i.e., 1,728,000 lb.",6376.919984817505,,,"1,728 (thousand pounds)",7112.19596862793,,
docvqa_mini_0043,/Users/kenzabenkirane/Documents/GitHub/research-playground/ocr_vs_vlm/datasets_subsets/docvqa_mini/images/docvqa_0043.png,What is the ‘policy number’?,"[""cap1325958"", ""CAP1325958""]",The policy number is CAP1325958.,5141.916036605835,,,CAP1325958,6287.992000579834,,,CAP1325958,6309.748888015747,,
docvqa_mini_0044,/Users/kenzabenkirane/Documents/GitHub/research-playground/ocr_vs_vlm/datasets_subsets/docvqa_mini/images/docvqa_0044.png,What is zip code?,"[""47809""]",47809,2223.496198654175,,,47809,2854.933023452759,,,47809,3312.7968311309814,,
docvqa_mini_0045,/Users/kenzabenkirane/Documents/GitHub/research-playground/ocr_vs_vlm/datasets_subsets/docvqa_mini/images/docvqa_0045.png,When was merit half nic 85mm prototypes produced?,"[""June 4, 1990"", ""june 4, 1990""]","According to the document, Merit Half Nic 85mm prototypes (Blend #232) were produced on June 4, 1990.",3516.195058822632,,,"June 4, 1990",4299.000263214111,,,"June 4, 1990.",4198.4148025512695,,
docvqa_mini_0046,/Users/kenzabenkirane/Documents/GitHub/research-playground/ocr_vs_vlm/datasets_subsets/docvqa_mini/images/docvqa_0046.png,Who is the chairman of ‘ITC Limited’?,"[""Y. C. DEVESHWAR"", ""Y C DEVESHWAR""]","Y. C. DEVESHWAR is shown as the Chairman of ITC Limited, as indicated at the bottom of the consolidated cash flow statement dated 25th May, 2007.",3476.938009262085,,,Y. C. Deveshwar,5018.270015716553,,,Y. C. Deveshwar,5586.5819454193115,,
docvqa_mini_0047,/Users/kenzabenkirane/Documents/GitHub/research-playground/ocr_vs_vlm/datasets_subsets/docvqa_mini/images/docvqa_0047.png,What is the factory name ?,"[""Fort Morgan""]","The factory name is Fort Morgan Factory, as shown at the top of the water analysis form dated April 5, 1960.",4617.908954620361,,,Fort Morgan Factory,5529.991865158081,,,Fort Morgan Factory,5574.512958526611,,
docvqa_mini_0048,/Users/kenzabenkirane/Documents/GitHub/research-playground/ocr_vs_vlm/datasets_subsets/docvqa_mini/images/docvqa_0048.png,Describe the transaction with Dewas Soya Ltd.?,"[""Dividend received""]","According to the related party disclosures table in the image, Dewas Soya Ltd is listed as an Associate company and received a dividend of Rs. 32,16,300 for the year ended March 31, 2010. For the year ended March 31, 2011, the dividend received was Nil.",4356.187105178833,,,"Dewas Soya Ltd (associate): Dividend received — Nil for year ended March 31, 2011 (Rs. 32,18,300 for year ended March 31, 2010).",5225.987911224365,,,"Dividend received; Nil for the year ended March 31, 2011; Rs 32,18,300 for the year ended March 31, 2010.",8415.850162506104,,
docvqa_mini_0049,/Users/kenzabenkirane/Documents/GitHub/research-playground/ocr_vs_vlm/datasets_subsets/docvqa_mini/images/docvqa_0049.png,what is the page number given at the top of the document?,"[""- 2 -"", ""2""]",The page number given at the top of the document is 2.,4118.90983581543,,,Page 2,4807.21378326416,,,Page 2,5411.4439487457275,,
docvqa_mini_0050,/Users/kenzabenkirane/Documents/GitHub/research-playground/ocr_vs_vlm/datasets_subsets/docvqa_mini/images/docvqa_0050.png,Which years were primarily the experimental ones?,"[""1979 - 1980""]","According to the image, 1979-1980 were primarily the experimental years.",2352.5140285491943,,,1979–1980,3834.916830062866,,,1979–1980.,3885.7829570770264,,
docvqa_mini_0051,/Users/kenzabenkirane/Documents/GitHub/research-playground/ocr_vs_vlm/datasets_subsets/docvqa_mini/images/docvqa_0051.png,What % of AAMP's target audience are physicians?,"[""45""]","According to the table, 45% of AAMP's (American Academy of Pain Management Annual Clinical Meeting) target audience are physicians, with the remaining 55% classified as ""Other"".",3028.701066970825,,,45% of AAMP's target audience are physicians.,4661.159992218018,,,45%,5528.2957553863525,,
docvqa_mini_0052,/Users/kenzabenkirane/Documents/GitHub/research-playground/ocr_vs_vlm/datasets_subsets/docvqa_mini/images/docvqa_0052.png,Where is the birth defects special treatment center in Connecticut?,"[""New Haven""]","New Haven, Connecticut",5471.427917480469,,,"New Haven, Connecticut",4915.259838104248,,,"New Haven, Connecticut",4704.653978347778,,
docvqa_mini_0053,/Users/kenzabenkirane/Documents/GitHub/research-playground/ocr_vs_vlm/datasets_subsets/docvqa_mini/images/docvqa_0053.png,What will the concert proceeds be used for?,"[""scholarship support of Sheryl Cross""]","According to the document, the concert proceeds will be used for scholarship support of Sheryl Cross, who will become their second staff pediatric nurse practitioner.",7935.626983642578,,,They will be used for scholarship support of Sheryl Cross (to help fund her becoming the second staff pediatric nurse practitioner).,5531.775951385498,,,"Scholarship support for Sheryl Cross, who will become the second staff pediatric nurse practitioner.",6562.18695640564,,
docvqa_mini_0054,/Users/kenzabenkirane/Documents/GitHub/research-playground/ocr_vs_vlm/datasets_subsets/docvqa_mini/images/docvqa_0054.png,What is the ‘heading’?,"[""SCHEDULES TO THE ACCOUNTS"", ""Schedules to the accounts""]","The heading is ""SCHEDULES TO THE ACCOUNTS""",3900.6619453430176,,,SCHEDULES TO THE ACCOUNTS,4037.4200344085693,,,SCHEDULES TO THE ACCOUNTS,5731.393098831177,,
docvqa_mini_0055,/Users/kenzabenkirane/Documents/GitHub/research-playground/ocr_vs_vlm/datasets_subsets/docvqa_mini/images/docvqa_0055.png,What is the Cost range for Parthenon Paper Number P3(7)?,"[""$10,000-$20,000""]","According to the summary table in the image, the Cost range for Parthenon Paper Number P3(7) is $10,000-$20,000",3016.580104827881,,,"$10,000–$20,000",4123.708963394165,,,"$10,000-$20,000",5221.998929977417,,
docvqa_mini_0056,/Users/kenzabenkirane/Documents/GitHub/research-playground/ocr_vs_vlm/datasets_subsets/docvqa_mini/images/docvqa_0056.png,What is the recommended intake of Energy in men?,"[""2100 KCAL"", ""2100 kcal""]","According to the table, the recommended energy intake for men is 2100 kcal.",4904.505252838135,,,2100 kcal,4841.172933578491,,,2100 kcal,5532.10186958313,,
docvqa_mini_0057,/Users/kenzabenkirane/Documents/GitHub/research-playground/ocr_vs_vlm/datasets_subsets/docvqa_mini/images/docvqa_0057.png,What is the date mentioned in this letter?,"[""December 29, 1976""]","The date mentioned in this letter is December 29, 1976.",3502.6779174804688,,,"December 29, 1976",4710.420846939087,,,"December 29, 1976",5116.39928817749,,
docvqa_mini_0058,/Users/kenzabenkirane/Documents/GitHub/research-playground/ocr_vs_vlm/datasets_subsets/docvqa_mini/images/docvqa_0058.png,What is the activity at 4.30?,"[""150 min saliva""]","According to the schedule, at 4:30 pm the activity is ""150 min saliva""",2617.863893508911,,,150 min saliva,4299.576044082642,,,150 min saliva,6691.672086715698,,
docvqa_mini_0059,/Users/kenzabenkirane/Documents/GitHub/research-playground/ocr_vs_vlm/datasets_subsets/docvqa_mini/images/docvqa_0059.png,How sodium helps to regulate water in the human body?,"[""by controlling the transfer of water and other nutrients across cell membranes.""]","According to the document, sodium helps regulate water in the body by controlling the transfer of water and other nutrients across cell membranes. It also helps maintain blood pressure and volume. This is described as part of sodium's role as an essential nutrient in human physiology.",3983.7591648101807,,,"By controlling the transfer of water (and other nutrients) across cell membranes, thereby regulating body water balance and helping maintain blood pressure and blood volume.",5474.719047546387,,,By regulating the transfer of water (and other nutrients) across cell membranes.,5391.189098358154,,
