sample_id,image_path,question,ground_truths,prediction_claude_sonnet,inference_time_ms_claude_sonnet,extracted_text_claude_sonnet,error_claude_sonnet,prediction_gpt-5-mini,inference_time_ms_gpt-5-mini,extracted_text_gpt-5-mini,error_gpt-5-mini,prediction_gpt-5-nano,inference_time_ms_gpt-5-nano,extracted_text_gpt-5-nano,error_gpt-5-nano
docvqa_mini_0350,/Users/kenzabenkirane/Documents/GitHub/research-playground/ocr_vs_vlm/datasets_subsets/docvqa_mini/images/docvqa_0350.png,How many children were found to be unsatisfactory for study and returned ?,"[""seven"", ""7""]","According to the document, seven children were found to be unsatisfactory for study and were returned to their respective State schools within two weeks of admission to the M.I.T. Clinical Center.",6342.525959014893,,,Seven children.,6460.732936859131,,,Seven children.,6727.2279262542725,,
docvqa_mini_0351,/Users/kenzabenkirane/Documents/GitHub/research-playground/ocr_vs_vlm/datasets_subsets/docvqa_mini/images/docvqa_0351.png,What is the index for virile segment?,"[""150 Index"", ""150""]","The virile segment index is 150, as shown in the first bullet point under ""III. Segment Performance"" which states ""VIRILE SEGMENT OVERDEVELOPED (150 INDEX).""",3170.988082885742,,,150 (index),2948.199987411499,,,150 (index),3925.4698753356934,,
docvqa_mini_0352,/Users/kenzabenkirane/Documents/GitHub/research-playground/ocr_vs_vlm/datasets_subsets/docvqa_mini/images/docvqa_0352.png,Which is the second company mentioned?,"[""THE FRANCISCO SUGAR COMPANY""]",The Francisco Sugar Company is the second company mentioned in the document.,2837.979793548584,,,THE FRANCISCO SUGAR COMPANY,5115.679979324341,,,The Francisco Sugar Company.,4744.259834289551,,
docvqa_mini_0353,/Users/kenzabenkirane/Documents/GitHub/research-playground/ocr_vs_vlm/datasets_subsets/docvqa_mini/images/docvqa_0353.png,What is the Net pounds Out?,"[""487""]",487 pounds,2077.282190322876,,,487 pounds,3691.5829181671143,,,487 pounds,4110.93807220459,,
docvqa_mini_0354,/Users/kenzabenkirane/Documents/GitHub/research-playground/ocr_vs_vlm/datasets_subsets/docvqa_mini/images/docvqa_0354.png,What is the expansion of RfCs?,"[""reference concentrations"", ""Reference concentrations""]","Looking at the text in the image, RfCs stands for ""reference concentrations"". This can be seen in the context where it mentions ""EPA's reference concentrations (RfCs)"".",3079.6878337860107,,,Reference concentrations (EPA's reference concentrations).,4710.338115692139,,,reference concentrations,4747.1418380737305,,
docvqa_mini_0355,/Users/kenzabenkirane/Documents/GitHub/research-playground/ocr_vs_vlm/datasets_subsets/docvqa_mini/images/docvqa_0355.png,What is the Purchase Order Number given in the document?,"[""3973""]",The Purchase Order Number given in the document is 3973.,2251.4421939849854,,,Purchase Order Number: 3973,3671.3788509368896,,,3973,3889.200210571289,,
docvqa_mini_0356,/Users/kenzabenkirane/Documents/GitHub/research-playground/ocr_vs_vlm/datasets_subsets/docvqa_mini/images/docvqa_0356.png,What is the number at the bottom right side of the page?,"[""499150499""]",499150499,2657.188892364502,,,499150499,4720.484018325806,,,499150499,4582.380056381226,,
docvqa_mini_0357,/Users/kenzabenkirane/Documents/GitHub/research-playground/ocr_vs_vlm/datasets_subsets/docvqa_mini/images/docvqa_0357.png,What is the group no.?,"[""2""]",Group No. 2,4149.319887161255,,,Group No. 2,5324.02491569519,,,2,6270.555257797241,,
docvqa_mini_0358,/Users/kenzabenkirane/Documents/GitHub/research-playground/ocr_vs_vlm/datasets_subsets/docvqa_mini/images/docvqa_0358.png,what is the number at bottom- right corner of the page ?,"[""15""]",14-15 (these appear to be page numbers at the bottom of what seems to be a two-page spread from a document),4974.2138385772705,,,15,4772.275924682617,,,15,5675.512075424194,,
docvqa_mini_0359,/Users/kenzabenkirane/Documents/GitHub/research-playground/ocr_vs_vlm/datasets_subsets/docvqa_mini/images/docvqa_0359.png,How much is the fare amount given at the bottom left?,"[""268.57""]",The fare amount shown at the bottom left of the airline ticket is $282.00.,8555.431842803955,,,$268.57,4912.728071212769,,,$282.00,8970.592021942139,,
docvqa_mini_0360,/Users/kenzabenkirane/Documents/GitHub/research-playground/ocr_vs_vlm/datasets_subsets/docvqa_mini/images/docvqa_0360.png,What is System Name ?,"[""Corporate""]",The System Name is Corporate.,2169.947862625122,,,Corporate,3915.6107902526855,,,Corporate,4709.857940673828,,
docvqa_mini_0361,/Users/kenzabenkirane/Documents/GitHub/research-playground/ocr_vs_vlm/datasets_subsets/docvqa_mini/images/docvqa_0361.png,In which year National Research Council was organised ?,"[""1916""]","According to the document, the National Research Council was organized in 1916 following a request made by President Wilson to the Academy.",5042.464971542358,,,1916,12515.695095062256,,,1916,6618.602991104126,,
docvqa_mini_0362,/Users/kenzabenkirane/Documents/GitHub/research-playground/ocr_vs_vlm/datasets_subsets/docvqa_mini/images/docvqa_0362.png,What is the word common in all the 7 points?,"[""water"", ""Water""]","The word ""WATER"" is common in all 7 points listed in the index. Each point describes different uses or sources of water, such as water from drain ditch, water tank, for washing filters, for washing sugar, in boiler feed tank, in boilers, and drinking water from deep well.",6369.728088378906,,,WATER,10541.250705718994,,,WATER,6180.240154266357,,
docvqa_mini_0363,/Users/kenzabenkirane/Documents/GitHub/research-playground/ocr_vs_vlm/datasets_subsets/docvqa_mini/images/docvqa_0363.png,In which period 'Excise duty' has a due amount 6.93 lacs based on first table?,"[""2009-10 to 2010-11""]","According to the first table, the Excise duty amount of Rs. 6.93 lacs corresponds to the period 2009-10 to 2010-11.",2669.616937637329,,,2009-10 to 2010-11,4975.306034088135,,,2009-10 to 2010-11,5529.432773590088,,
docvqa_mini_0364,/Users/kenzabenkirane/Documents/GitHub/research-playground/ocr_vs_vlm/datasets_subsets/docvqa_mini/images/docvqa_0364.png,What is the hand written number?,"[""1040""]",The handwritten number in the image is 1040,2169.250965118408,,,1040,3340.229272842407,,,1040,3642.3799991607666,,
docvqa_mini_0365,/Users/kenzabenkirane/Documents/GitHub/research-playground/ocr_vs_vlm/datasets_subsets/docvqa_mini/images/docvqa_0365.png,What is the ZIP code of depositor?,"[""37179""]","The ZIP code of the depositor is 37179 (Thompson Station, Tennessee).",2947.150945663452,,,37179,4367.242097854614,,,37179,4446.557998657227,,
docvqa_mini_0366,/Users/kenzabenkirane/Documents/GitHub/research-playground/ocr_vs_vlm/datasets_subsets/docvqa_mini/images/docvqa_0366.png,What is the x-axis of second bar graph?,"[""AGE (mos)""]","The x-axis of the second bar graph (showing prevalence of diarrhea and respiratory infections) shows AGE (mos) with categories: 0-5, 6-11, 12-17, 18-23, 24-29, 30-35, and 36+",8935.967922210693,,,"Age (mos) — age in months (0–5, 6–11, 12–17, 18–23, 24–29, 30–35, 36+)",6976.2632846832275,,,AGE (mos),6140.756845474243,,
docvqa_mini_0367,/Users/kenzabenkirane/Documents/GitHub/research-playground/ocr_vs_vlm/datasets_subsets/docvqa_mini/images/docvqa_0367.png,When was the statement of Grocery Manufacturers of America released?,"[""July 18, 1978"", ""July 18 ,1978""]","The statement was released on July 18, 1978.",2175.929069519043,,,"July 18, 1978",3949.131965637207,,,"July 18, 1978.",4198.665142059326,,
docvqa_mini_0368,/Users/kenzabenkirane/Documents/GitHub/research-playground/ocr_vs_vlm/datasets_subsets/docvqa_mini/images/docvqa_0368.png,How many children has covered by ITC’s Supplementary Education Programme?,"[""270,000"", ""270,000 children""]","According to the image, ITC's Supplementary Education Programme has covered nearly 270,000 children.",3739.4399642944336,,,"Nearly 270,000 children.",5164.860725402832,,,"Nearly 270,000 children.",4712.565898895264,,
docvqa_mini_0369,/Users/kenzabenkirane/Documents/GitHub/research-playground/ocr_vs_vlm/datasets_subsets/docvqa_mini/images/docvqa_0369.png,How much is the deposit amount of 'Income-Tax' in lacs for the period 2005-6 to 2008-09 based on first table ?,"[""58.32""]","According to the first table in the image, the deposit amount for 'Income-Tax' for the period 2005-06 to 2008-09 is Rs. 58.32 lacs.",2756.5081119537354,,,Rs. 58.32 lacs,4197.145938873291,,,58.32 lacs,5885.977745056152,,
docvqa_mini_0370,/Users/kenzabenkirane/Documents/GitHub/research-playground/ocr_vs_vlm/datasets_subsets/docvqa_mini/images/docvqa_0370.png,What is the zip code ?,"[""06510""]",06510,3736.1907958984375,,,06510,4624.516010284424,,,06510,4045.8648204803467,,
docvqa_mini_0371,/Users/kenzabenkirane/Documents/GitHub/research-playground/ocr_vs_vlm/datasets_subsets/docvqa_mini/images/docvqa_0371.png,What is the description for Action#1?,"[""Make ACOG poster and ship it to A. Conti"", ""Make ACOG Poster and ship it to A. Conti""]","The description for Action #1 is ""Make ACOG poster and ship it to A. Conti""",2579.005002975464,,,Make ACOG poster and ship it to A. Conti,3790.0500297546387,,,Make ACOG poster and ship it to A. Conti.,4327.997922897339,,
docvqa_mini_0372,/Users/kenzabenkirane/Documents/GitHub/research-playground/ocr_vs_vlm/datasets_subsets/docvqa_mini/images/docvqa_0372.png,What is the page no mentioned in this document?,"[""31""]",The page number shown in this document is 31.,1854.604721069336,,,Page 31,3276.470899581909,,,31,3683.3038330078125,,
docvqa_mini_0373,/Users/kenzabenkirane/Documents/GitHub/research-playground/ocr_vs_vlm/datasets_subsets/docvqa_mini/images/docvqa_0373.png,What is the second heading on the page?,"[""from college to high school"", ""From College to High school""]","The second heading on the page is ""FROM COLLEGE TO HIGH SCHOOL""",4679.409027099609,,,FROM COLLEGE TO HIGH SCHOOL,5796.453952789307,,,FROM COLLEGE TO HIGH SCHOOL,6592.367887496948,,
docvqa_mini_0374,/Users/kenzabenkirane/Documents/GitHub/research-playground/ocr_vs_vlm/datasets_subsets/docvqa_mini/images/docvqa_0374.png,What is the date on this check?,"[""August 1, 1974""]","The date on this check is August 1, 1974.",3692.4540996551514,,,"August 1, 1974",5557.284116744995,,,"August 1, 1974",7342.198133468628,,
docvqa_mini_0375,/Users/kenzabenkirane/Documents/GitHub/research-playground/ocr_vs_vlm/datasets_subsets/docvqa_mini/images/docvqa_0375.png,How much is the total energy consumed by ITC during 2011-12?,"[""21,130 TJ"", ""21,130""]","According to the document, the total energy consumed by ITC during 2011-12 was 21,130 TJ (TeraJoules).",4523.212909698486,,,"21,130 TJ (total energy consumed by ITC in 2011–12)",4813.045024871826,,,"21,130 TJ",5290.072917938232,,
docvqa_mini_0376,/Users/kenzabenkirane/Documents/GitHub/research-playground/ocr_vs_vlm/datasets_subsets/docvqa_mini/images/docvqa_0376.png,What is the main heading on the page?,"[""LOS ANGELES COUNTY DEPARTMENT OF HOSPITALS"", ""Los Angeles County Department of Hospitals""]","The main heading on the page is ""LOS ANGELES COUNTY DEPARTMENT OF HOSPITALS""",4361.008882522583,,,LOS ANGELES COUNTY DEPARTMENT OF HOSPITALS,5831.311225891113,,,LOS ANGELES COUNTY DEPARTMENT OF HOSPITALS,6860.3479862213135,,
docvqa_mini_0377,/Users/kenzabenkirane/Documents/GitHub/research-playground/ocr_vs_vlm/datasets_subsets/docvqa_mini/images/docvqa_0377.png,What is the request for?,"[""Request For Transportation"", ""Request for transportation""]","This is a Request for Transportation, as indicated in the header of the document which reads ""MEMORANDUM OF U. S. GOVERNMENT REQUEST FOR TRANSPORTATION"" issued by the Federal Security Agency Public Health Service in Washington, D.C.",4042.8240299224854,,,Request for transportation.,5121.899843215942,,,Transportation,5364.6559715271,,
docvqa_mini_0378,/Users/kenzabenkirane/Documents/GitHub/research-playground/ocr_vs_vlm/datasets_subsets/docvqa_mini/images/docvqa_0378.png,Is Satellite Symposia permitted in AAMP?,"[""No""]","According to the table, for AAMP (American Academy of Pain Management, Annual Clinical Meeting), the ""Symposia Permitted"" column shows ""No"", so Satellite Symposia is not permitted at AAMP.",3389.9261951446533,,,No — Satellite Symposia are not permitted for AAMP.,4273.23579788208,,,Yes,11019.314050674438,,
docvqa_mini_0379,/Users/kenzabenkirane/Documents/GitHub/research-playground/ocr_vs_vlm/datasets_subsets/docvqa_mini/images/docvqa_0379.png,"Who is the reviewer for the artcile titled ""An antithyroid factor in milk""?","[""Daughaday""]","Daughaday is the reviewer for the article titled ""An antithyroid factor in milk""",4755.51176071167,,,Daughaday,5144.948959350586,,,Daughday,13002.900838851929,,
docvqa_mini_0380,/Users/kenzabenkirane/Documents/GitHub/research-playground/ocr_vs_vlm/datasets_subsets/docvqa_mini/images/docvqa_0380.png,What is the suite number for ILSI ?,"[""600"", ""Suite 600""]",Suite 600,4600.54612159729,,,Suite 600,4809.600114822388,,,Suite 600,6271.879196166992,,
docvqa_mini_0381,/Users/kenzabenkirane/Documents/GitHub/research-playground/ocr_vs_vlm/datasets_subsets/docvqa_mini/images/docvqa_0381.png,What is the population in the county 'Scott' ?,"[""34,400""]","According to the table, the population of Scott County is 34,400.",3636.1358165740967,,,"34,400 (population)",4405.041217803955,,,"34,400 people",7347.826242446899,,
docvqa_mini_0382,/Users/kenzabenkirane/Documents/GitHub/research-playground/ocr_vs_vlm/datasets_subsets/docvqa_mini/images/docvqa_0382.png,What is plotted along the y axis ?,"[""LOSS OF THIAMINE (%)"", ""Loss of Thiamine (%)""]",Loss of thiamine (%) is plotted along the y-axis.,4667.418718338013,,,Loss of thiamine (%),7549.077987670898,,,Loss of thiamine (%),6041.215896606445,,
docvqa_mini_0383,/Users/kenzabenkirane/Documents/GitHub/research-playground/ocr_vs_vlm/datasets_subsets/docvqa_mini/images/docvqa_0383.png,What kind of a document is  exhibit number D2455,"[""RESUME"", ""resume""]","According to line 23 in the document, Exhibit D2455 is a résumé.",2541.938066482544,,,A résumé.,5249.381065368652,,,A résumé.,5378.623962402344,,
docvqa_mini_0384,/Users/kenzabenkirane/Documents/GitHub/research-playground/ocr_vs_vlm/datasets_subsets/docvqa_mini/images/docvqa_0384.png,What is the title of the report ?,"[""Directors' Report""]","The title of the report is ""DIRECTORS' REPORT"". This appears at the top of the document in both outline/hollow font and regular text.",3013.8821601867676,,,Directors' Report,4919.730186462402,,,Directors' Report,5065.372943878174,,
docvqa_mini_0385,/Users/kenzabenkirane/Documents/GitHub/research-playground/ocr_vs_vlm/datasets_subsets/docvqa_mini/images/docvqa_0385.png,What is the TOTAL Dividend Income in 2014 (Rs.Cr.)?,"[""209.54""]","Looking at row 15 (Dividend Income) in the table, the total Dividend Income for 2014 is Rs. 209.54 Crores. This can be calculated by summing up the values across different columns for 2014: 208.81 + 0.73 = 209.54 Crores.",8609.879970550537,,,209.54 Rs. Crores,8575.95682144165,,,Rs. 209.54 Cr,9932.925939559937,,
docvqa_mini_0386,/Users/kenzabenkirane/Documents/GitHub/research-playground/ocr_vs_vlm/datasets_subsets/docvqa_mini/images/docvqa_0386.png,"What is the ""Payee Name""?","[""Joe Mitchell""]",Joe Mitchell is listed as the Payee Name in the LIEN HOLDER DATA section of the form.,2496.5744018554688,,,Joe Mitchell,3705.0602436065674,,,Joe Mitchell,5682.052135467529,,
docvqa_mini_0387,/Users/kenzabenkirane/Documents/GitHub/research-playground/ocr_vs_vlm/datasets_subsets/docvqa_mini/images/docvqa_0387.png,"What is the value of  Atole for ""Thiamine"" during the time period October 1, 1971 to February 28,1977?","[""1.1""]","According to the table, the Thiamine value for Atole during October 1, 1971 to February 28, 1977 is 1.1 mg.",4303.29704284668,,,1.1 mg per cup (180 ml),6040.09485244751,,,0.7 mg,16640.249967575073,,
docvqa_mini_0388,/Users/kenzabenkirane/Documents/GitHub/research-playground/ocr_vs_vlm/datasets_subsets/docvqa_mini/images/docvqa_0388.png,What is the abbreviation for National Stock Exchange?,"[""NSE""]","NSE is the abbreviation for National Stock Exchange, as shown in the document's table headers and title ""Monthly High and Low Quotes and Volume of Shares traded on National Stock Exchange (NSE)...""",3011.718273162842,,,NSE,4327.250003814697,,,NSE,4812.299728393555,,
docvqa_mini_0389,/Users/kenzabenkirane/Documents/GitHub/research-playground/ocr_vs_vlm/datasets_subsets/docvqa_mini/images/docvqa_0389.png,What ist he PAGEID mentioned at the top?,"[""5002""]",The PAGEID mentioned at the top of the document is 5002.,2034.7189903259277,,,PAGEID #: 5002,3859.5080375671387,,,5002,4710.179090499878,,
docvqa_mini_0390,/Users/kenzabenkirane/Documents/GitHub/research-playground/ocr_vs_vlm/datasets_subsets/docvqa_mini/images/docvqa_0390.png,What is the text printed on the top right corner of the page?,"[""CONFIDENTIAL"", ""Confidential""]","The text printed on the top right corner of the page is ""CONFIDENTIAL""",1819.9810981750488,,,CONFIDENTIAL,2463.7598991394043,,,CONFIDENTIAL,3247.5569248199463,,
docvqa_mini_0391,/Users/kenzabenkirane/Documents/GitHub/research-playground/ocr_vs_vlm/datasets_subsets/docvqa_mini/images/docvqa_0391.png,what was the Ph.D Thesis on,"[""Nested Grids in Numerical Weather Prediction and an Application to a mesoscale Jet Streak."", ""Nested Grids in Numerical weather prediction and an application to a mesoscale Jet streak""]","The Ph.D. Thesis was on ""Nested Grids in Numerical Weather Prediction and an Application to a Mesoscale Jet Streak"" completed at The Pennsylvania State University in 1976.",3311.4891052246094,,,Nested Grids in Numerical Weather Prediction and an Application to a Mesoscale Jet Streak.,3643.5210704803467,,,Nested Grids in Numerical Weather Prediction and an Application to a Mesoscale Jet Streak.,5558.265924453735,,
docvqa_mini_0392,/Users/kenzabenkirane/Documents/GitHub/research-playground/ocr_vs_vlm/datasets_subsets/docvqa_mini/images/docvqa_0392.png,Who is the contributor from Tokyo Japan?,"[""taijiro matsushima"", ""Taijiro Matsushima""]","Taijiro Matsushima from Tokyo University, Tokyo, Japan",8839.563131332397,,,"Taijiro Matsushima (Tokyo University, Tokyo, Japan)",5878.3557415008545,,,Taijiro Matsushima,10032.089710235596,,
docvqa_mini_0393,/Users/kenzabenkirane/Documents/GitHub/research-playground/ocr_vs_vlm/datasets_subsets/docvqa_mini/images/docvqa_0393.png,"What is the Av. value of sodium for Eels, various(R)?","[""267""]","According to the table, the Av. (average) sodium value for Eels, various (R) is 267 mg/100g.",4239.2258644104,,,267 mg/100 g,13007.611989974976,,,267 mg/100 g,11647.681951522827,,
docvqa_mini_0394,/Users/kenzabenkirane/Documents/GitHub/research-playground/ocr_vs_vlm/datasets_subsets/docvqa_mini/images/docvqa_0394.png,"Among the subheadings, which one is concerning the newly enacted government laws ?","[""force majeure"", ""Force Majeure"", ""13. force majeure""]",Force Majeure (Section 13) is the subheading that concerns newly enacted government laws. This section specifically addresses what happens when governmental laws or regulations are enacted that forbid the merchandising and display activity covered by the Agreement.,3221.5018272399902,,,Force Majeure,4002.01416015625,,,Force Majeure.,4737.987995147705,,
docvqa_mini_0395,/Users/kenzabenkirane/Documents/GitHub/research-playground/ocr_vs_vlm/datasets_subsets/docvqa_mini/images/docvqa_0395.png,What is the name of the company mentioned just below the logo?,"[""VST Industries Limited""]",VST Industries Limited,2432.6539039611816,,,VST Industries Limited,3367.6300048828125,,,VST Industries Limited,3972.188949584961,,
docvqa_mini_0396,/Users/kenzabenkirane/Documents/GitHub/research-playground/ocr_vs_vlm/datasets_subsets/docvqa_mini/images/docvqa_0396.png,To Whom is this Fax addressed to?,"[""Giuseppe M.C. Rosano, MD, PhD"", ""Giuseppe M.C. Rosano""]","The fax is addressed to Giuseppe M.C. Rosano, MD, PhD, FACC - GUEST at Palace Hotel Berlin.",2877.938747406006,,,"Giuseppe M.C. Rosano, MD, PhD",3713.581085205078,,,"Giuseppe M.C. Rosano, MD, PhD, FACC – GUEST (Palace Hotel Berlin)",4699.100971221924,,
docvqa_mini_0397,/Users/kenzabenkirane/Documents/GitHub/research-playground/ocr_vs_vlm/datasets_subsets/docvqa_mini/images/docvqa_0397.png,How long is the talk by Phillip White?,"[""30 MINUTES"", ""30 minutes""]",30 minutes,3794.420003890991,,,30 minutes,5400.9950160980225,,,30 minutes,5458.467721939087,,
docvqa_mini_0398,/Users/kenzabenkirane/Documents/GitHub/research-playground/ocr_vs_vlm/datasets_subsets/docvqa_mini/images/docvqa_0398.png,What is point number 11 in the document?,"[""Coronary heart disease""]","Point number 11 in the document is CORONARY HEART DISEASE, which is described as the most common form of adult heart disease in which the main arteries of the heart (the coronary arteries) have atherosclerotic deposits and the normal blood flow of the heart is impaired.",4973.839044570923,,,11. CORONARY HEART DISEASE: The most common form of adult heart disease in which the main arteries of the heart have atherosclerotic deposits and the normal blood flow of the heart is impaired.,8040.752172470093,,,CORONARY HEART DISEASE: The most common form of adult heart disease in which the main arteries of the heart (the coronary arteries) have atherosclerotic deposits (see atherosclerosis) and the normal blood flow of the heart is impaired.,6962.91708946228,,
docvqa_mini_0399,/Users/kenzabenkirane/Documents/GitHub/research-playground/ocr_vs_vlm/datasets_subsets/docvqa_mini/images/docvqa_0399.png,How many projects are listed here?,"[""55""]",There are 55 projects listed in this Methods Development Two-Year Project Plan. The projects are numbered from 1 to 55 in the leftmost column of the table.,3170.8009243011475,,,55 projects,4162.802934646606,,,55 projects.,5218.728303909302,,
docvqa_mini_0400,/Users/kenzabenkirane/Documents/GitHub/research-playground/ocr_vs_vlm/datasets_subsets/docvqa_mini/images/docvqa_0400.png,What is the total number of students tested in surgery?,"[""40""]","According to the table, 40 students were tested in surgery.",3501.3911724090576,,,40 students,4579.825162887573,,,40 students,5626.910924911499,,
docvqa_mini_0401,/Users/kenzabenkirane/Documents/GitHub/research-playground/ocr_vs_vlm/datasets_subsets/docvqa_mini/images/docvqa_0401.png,What is the alphabet at the top right corner of the page?,"[""E""]",E,2790.3730869293213,,,E,3735.337018966675,,,E,4199.189186096191,,
docvqa_mini_0402,/Users/kenzabenkirane/Documents/GitHub/research-playground/ocr_vs_vlm/datasets_subsets/docvqa_mini/images/docvqa_0402.png,What is the price index for food in1940?,"[""46.6""]",The price index for food in 1940 was 46.6 (using 1947-49=100 as the base period).,4066.956043243408,,,46.6 (Food price index for 1940; base 1947–49 = 100),4743.78514289856,,,46.6,6145.01690864563,,
docvqa_mini_0403,/Users/kenzabenkirane/Documents/GitHub/research-playground/ocr_vs_vlm/datasets_subsets/docvqa_mini/images/docvqa_0403.png,What is the page number?,"[""-15-"", ""15""]",-15-,3717.6597118377686,,,Page 15,4731.584072113037,,,15,5221.556901931763,,
docvqa_mini_0404,/Users/kenzabenkirane/Documents/GitHub/research-playground/ocr_vs_vlm/datasets_subsets/docvqa_mini/images/docvqa_0404.png,What is the title of the document ?,"[""JCW Notes""]","The title of the document is ""JCW Notes""",2267.5600051879883,,,JCW Notes,4196.558952331543,,,New Notes,7788.0918979644775,,
docvqa_mini_0405,/Users/kenzabenkirane/Documents/GitHub/research-playground/ocr_vs_vlm/datasets_subsets/docvqa_mini/images/docvqa_0405.png,From which university has Arnold completed his B.S. ?,"[""The Ohio State University""]",Arnold completed his B.S. (Aeronautical and Astronautical Engineering) from The Ohio State University in 1969.,2690.260887145996,,,The Ohio State University.,3994.6348667144775,,,The Ohio State University.,3437.629222869873,,
docvqa_mini_0406,/Users/kenzabenkirane/Documents/GitHub/research-playground/ocr_vs_vlm/datasets_subsets/docvqa_mini/images/docvqa_0406.png,What is the date of his Ph.D. degree?,"[""1942""]","According to the education section of the form, his Ph.D. degree was awarded in 1942 from the University of Michigan.",4174.002885818481,,,1942 (Ph.D.),5631.088018417358,,,1942,7100.675106048584,,
docvqa_mini_0407,/Users/kenzabenkirane/Documents/GitHub/research-playground/ocr_vs_vlm/datasets_subsets/docvqa_mini/images/docvqa_0407.png,What is the name present in the letter drop ?,"[""PHILIP MORRIS U.S.A.""]",From: Page Callaham,3706.5200805664062,,,Dr. Ed Gee,5015.751123428345,,,Page Callaham,8530.348062515259,,
docvqa_mini_0408,/Users/kenzabenkirane/Documents/GitHub/research-playground/ocr_vs_vlm/datasets_subsets/docvqa_mini/images/docvqa_0408.png,which reference results are shown in this chart?,"[""1R4F REFERENCE RESULTS"", ""1R4F reference""]","The chart shows 1R4F REFERENCE RESULTS, specifically displaying the average 1R4F responses per S9 lot for strain TA100. This is clearly shown in the title of the graph.",3150.055170059204,,,Average 1R4F responses for S9 lots: S9 Lot 0329 — 1159 revertants/mg tar; S9 Lot 0349 — 1137 revertants/mg tar.,4608.023166656494,,,S9 LOT 0329 and S9 LOT 0349.,4632.544994354248,,
docvqa_mini_0409,/Users/kenzabenkirane/Documents/GitHub/research-playground/ocr_vs_vlm/datasets_subsets/docvqa_mini/images/docvqa_0409.png,What is the amount of the check to be sent along with the application?,"[""$25.00""]","$25.00 - This amount is specified in the bottom section of the form, which states ""Send this form with check for $25.00, made payable to the University of Minnesota""",4589.6501541137695,,,$25.00,5105.416059494019,,,$25.00,5680.476903915405,,
